title,subreddit,score,id,url,num_comments,created_utc,selftext,over_18,compound,neg,neu,pos
"After CIA briefing, Republicans say 'no question' Saudi crown prince ordered Khashoggi murder",politics,31767,a337ud,https://abcnews.go.com/Politics/cia-director-briefs-small-group-senators-saudi-crown/story?id=59598135,1379,2018-12-04 13:16:33,,False,-0.7845,0.385,0.615,0.0
"‘Damn Right, I’m a White Nationalist’ Declares Texas GOP Platform Committee Member",politics,21600,a31z53,https://www.texasobserver.org/damn-right-im-a-white-nationalist-declares-texas-gop-platform-committee-member/,2311,2018-12-04 11:04:43,,False,0.0,0.0,1.0,0.0
'This is a disgrace': Alexandria Ocasio-Cortez slams her future colleagues in Congress for employing unpaid interns and failing to pay staffers a 'living wage',politics,8007,a32lou,https://www.businessinsider.com/alexandria-ocasio-cortez-slams-future-colleagues-congress-for-employing-unpaid-interns-living-wage-2018-12,816,2018-12-04 12:10:00,,False,-0.5719,0.19,0.81,0.0
"A woman says she was paid to collect absentee ballots by a convicted felon with ties to GOP campaign She also says she didn't mail in the ballots she collected, delivering them directly to the GOP operative instead.",politics,16551,a31dwt,https://thinkprogress.org/north-carolina-election-fraud-ballots-leslie-mccrae-dowless-c23755510bf6/,662,2018-12-04 09:58:51,,False,-0.2732,0.057,0.943,0.0
"2 attorneys general to subpoena Trump Organization, IRS",politics,3589,a344gc,https://apnews.com/8335d630f04248fe9175f893c6641729?utm_medium=AP&utm_campaign=SocialFlow&utm_source=Twitter,240,2018-12-04 14:48:05,,False,0.0,0.0,1.0,0.0
GOP senators come out and say it: The Trump administration is covering up Khashoggi’s killing,politics,4106,a33myt,https://www.washingtonpost.com/politics/2018/12/04/gop-senators-come-out-say-it-trump-administration-is-covering-up-khashoggis-killing/,212,2018-12-04 13:58:47,,False,-0.6597,0.239,0.761,0.0
Incoming majority leader says House should consider not seating North Carolina Republican amid election-fraud investigation,politics,5510,a32h7z,https://www.washingtonpost.com/news/politics/wp/2018/12/04/incoming-majority-leader-says-house-should-consider-not-seating-north-carolina-republican-amid-election-fraud-investigation/,167,2018-12-04 11:57:41,,False,0.0,0.0,1.0,0.0
'This Is a Coup': Protests Engulf Wisconsin Capitol as Outgoing Scott Walker and GOP Move to Cripple Democratic Power,politics,48891,a30t9k,https://www.commondreams.org/news/2018/12/04/coup-protests-engulf-wisconsin-capitol-outgoing-scott-walker-and-gop-move-cripple,3257,2018-12-04 08:47:48,,False,0.0772,0.095,0.796,0.109
State Republicans Are Refusing to Honor the Peaceful Transition of Power,politics,4072,a32x8n,https://www.thenation.com/article/wisconsin-michigan-republican-lame-duck-power-grab/,179,2018-12-04 12:43:06,,False,0.5719,0.158,0.468,0.374
Second woman says she was paid to collect absentee ballots in North Carolina House race,politics,2673,a348vz,https://thehill.com/homenews/campaign/419693-second-woman-says-she-was-paid-to-collect-absentee-ballots-in-north,175,2018-12-04 15:01:02,,False,-0.2732,0.13,0.87,0.0
Reps Lieu and Rice Call For Investigation Into Conduct of Manafort's Lawyers,politics,2770,a33rmw,https://lieu.house.gov/media-center/press-releases/reps-lieu-and-rice-call-investigation-conduct-manaforts-lawyers,118,2018-12-04 14:11:45,,False,0.0,0.0,1.0,0.0
"Trump admits his ""incredible"" deal with China is bullshit",politics,3025,a3338h,https://www.vanityfair.com/news/2018/12/trump-admits-his-incredible-deal-with-china-is-bullshit,220,2018-12-04 12:59:49,,False,-0.3818,0.292,0.538,0.169
"Only Republicans Are Allowed to Govern, Say Republicans",politics,2619,a33e8q,https://www.esquire.com/news-politics/politics/a25397686/wisconsin-republican-power-grab-scott-fitzgerald/,117,2018-12-04 13:33:31,,False,0.0,0.0,1.0,0.0
Emails of top NRCC officials stolen in major 2018 hack,politics,3481,a32g59,https://www.politico.com/story/2018/12/04/exclusive-emails-of-top-nrcc-officials-stolen-in-major-2018-hack-1043309,362,2018-12-04 11:54:29,,False,-0.34,0.246,0.615,0.138
"In States They Lost, Some GOP Lawmakers Rush To Limit New Democrats' Power",politics,9547,a30ear,https://www.npr.org/2018/12/04/673020090/in-states-they-lost-some-gop-lawmakers-rush-to-limit-new-democrats-power,498,2018-12-04 07:50:31,,False,-0.3182,0.161,0.839,0.0
Mattis says war in Afghanistan needs to end: ‘40 years is enough’,politics,6164,a30rqw,https://itk.thehill.com/homenews/administration/419584-mattis-says-war-in-afghanistan-needs-to-end-40-years-is-enough,674,2018-12-04 08:42:11,,False,-0.5994,0.262,0.738,0.0
Trump's 'incredible deal' with China doesn't appear to exist,politics,6572,a30iqj,http://www.msnbc.com/rachel-maddow-show/trumps-incredible-deal-china-doesnt-appear-exist,382,2018-12-04 08:07:55,,False,0.0,0.0,1.0,0.0
Subpoena Issued To GOP Campaign Tangled In NC Election Fraud Mess,politics,3298,a31zb3,https://talkingpointsmemo.com/muckraker/subpoena-issued-to-gop-campaign-tangled-in-nc-election-fraud-mess,38,2018-12-04 11:05:14,,False,-0.743,0.412,0.588,0.0
Corker: Saudi crown prince would be convicted of murder in ‘30 minutes’,politics,2116,a33c0g,https://www.politico.com/story/2018/12/04/saudi-brief-anger-1043500,63,2018-12-04 13:27:26,,False,-0.6908,0.299,0.701,0.0
Republicans Finally Have a Voter Fraud Scandal. And None of Them Want to Talk About It.,politics,39674,a2zron,https://www.motherjones.com/politics/2018/12/republicans-finally-have-a-voter-fraud-scandal-and-none-of-them-want-to-talk-about-it/,2219,2018-12-04 06:13:33,,False,-0.7859,0.398,0.602,0.0
"13 Trump entities being subpoenaed in case targeting president’s D.C. hotel, potentially revealing private details of his business",politics,1390,a34k4v,https://www.washingtonpost.com/news/politics/wp/2018/12/04/13-trump-entities-being-subpoenaed-in-case-targeting-presidents-d-c-hotel-potentially-revealing-private-details-of-his-business/,109,2018-12-04 15:32:48,,False,0.0,0.0,1.0,0.0
NC GOP misleads about NC election fraud investigation,politics,3081,a31pci,https://www.politifact.com/north-carolina/statements/2018/dec/04/north-carolina-republican-party/nc-gop-misleads-about-nc-election-fraud-investigat/,75,2018-12-04 10:34:52,,False,-0.5859,0.352,0.648,0.0
Trump Kicks Off the Week With Some Light Witness Tampering,politics,3867,a30rf3,https://www.rollingstone.com/politics/politics-news/trump-witness-tampering-762562/,67,2018-12-04 08:40:55,,False,0.0,0.0,1.0,0.0
"Dow drops 450 points on fears of slowing economic growth, banks lead the decline",politics,1884,a32qj7,https://www.cnbc.com/2018/12/04/stock-market-dow-futures-fall-amid-us-china-trade-deal-skepticism.html,263,2018-12-04 12:23:56,,False,-0.0516,0.161,0.69,0.149
"House Intel Committee Member Suggests Roger Stone, Erik Prince, Others May Have Lied to Congress",politics,1415,a33e8e,https://www.rollingstone.com/politics/politics-news/roger-stone-congress-testimony-762006/,51,2018-12-04 13:33:29,,False,-0.3818,0.157,0.843,0.0
Hilarious Supercut Shows Trump Repeatedly Wandering Off During Important Events,politics,4328,a30bog,https://www.huffingtonpost.com/entry/donald-trump-walking-away-supercut_us_5c06486ce4b07aec57521b6a,414,2018-12-04 07:40:03,,False,0.5423,0.0,0.64,0.36
The Latest: NATO allies say Russia is violating nuclear pact,politics,1566,a32s4g,https://apnews.com/73bc3d41f91847e89b89bf0b9841a0ec?utm_campaign=SocialFlow&utm_source=Twitter&utm_medium=AP,47,2018-12-04 12:28:20,,False,-0.5423,0.28,0.72,0.0
"Trump says the US loses $250 billion on illegal immigration every year. We checked. It doesn’t. Another day, another Trump tweet featuring a loose interpretation of numbers.",politics,1249,a33hgj,https://www.vox.com/2018/12/4/18125661/trump-immigration-data-fact-check,71,2018-12-04 13:43:07,,False,-0.802,0.263,0.737,0.0
"Dow plummets 800 points over economic, trade concerns",politics,1066,a33ydf,https://thehill.com/policy/finance/419682-dow-plummets-800-points-over-economic-trade-concerns,170,2018-12-04 14:31:03,,False,0.0,0.0,1.0,0.0
The Republic after Trump: We need to install new guardrails to stop future Presidents from doing what this one has done,politics,944,a34dkb,https://www.nydailynews.com/opinion/ny-oped-the-republic-after-trump-20181203-story.html,82,2018-12-04 15:14:12,,False,-0.296,0.099,0.901,0.0
'This is not democracy': Republicans try to shrink power of incoming Democrats,politics,3873,a307we,https://www.theguardian.com/us-news/2018/dec/04/republicans-democrats-michigan-wisconsin-voting-midterms,161,2018-12-04 07:24:56,,False,0.0,0.0,1.0,0.0
Mueller is about to drop major new details about 3 of the most important players in the Russia probe,politics,4415,a3005p,https://amp.businessinsider.com/mueller-sentencing-memos-manafort-cohen-flynn-2018-12,572,2018-12-04 06:53:06,,False,-0.0018,0.104,0.792,0.104
The GOP’s 2018 Autopsy: Democracy Is Our Enemy,politics,2087,a31lih,http://nymag.com/intelligencer/2018/12/wisconsin-republican-powergrab-gop-2018-autopsy-democracy-is-our-enemy.html,83,2018-12-04 10:22:34,,False,-0.5423,0.333,0.667,0.0
"More Than 400 Justice Department Alumni Say They're ""Disturbed"" By Matthew Whitaker's Appointment",politics,915,a347sx,https://www.buzzfeednews.com/article/zoetillman/justice-department-matthew-whitaker-attorney-general,26,2018-12-04 14:57:53,,False,0.5667,0.0,0.766,0.234
Florida SWAT Officer Demoted After Wearing QAnon Patch In Photo With Mike Pence,politics,2366,a313rj,https://www.huffingtonpost.com/entry/florida-cop-qanon-mike-pence_us_5c05c223e4b0cd916faf01b7?fbclid=IwAR3z_K75SDIlD-qh-wCJQ-Z_uJsATTmTJDpW2qLdcvv91_9UiNZbh4qOhmo,323,2018-12-04 09:24:42,,False,0.0,0.0,1.0,0.0
Trump’s fortress of corruption is cracking. Here are the latest signs.,politics,1840,a31tqo,https://www.washingtonpost.com/blogs/plum-line/wp/2018/12/04/trumps-fortress-of-corruption-is-cracking-here-are-the-latest-signs,125,2018-12-04 10:48:22,,False,0.0,0.0,1.0,0.0
"US senators: 'Zero doubt' MBS ordered killing of Jamal Khashoggi; After briefing by CIA chief, senators say US must send strong message to Saudi crown prince over murder of Khashoggi.",politics,1133,a337xg,https://www.aljazeera.com/news/2018/12/senators-doubt-mbs-ordered-khashoggi-killing-181204175113812.html,72,2018-12-04 13:16:42,,False,-0.8519,0.284,0.636,0.081
Michael Flynn Sentencing: Robert Mueller Set to Recommend Prison Term for Former Trump Aide,politics,2644,a30pxu,https://www.newsweek.com/michael-flynn-sentencing-robert-mueller-set-recommend-prison-term-former-1242980,186,2018-12-04 08:35:31,,False,-0.34,0.266,0.598,0.136
A new CIA leak adds to the evidence against MBS. Congress must act.,politics,5004,a2zcmo,https://www.washingtonpost.com/opinions/global-opinions/the-trump-administration-is-denying-the-reality-of-saudi-arabias-role-in-khashoggis-death/2018/12/03/db2304ce-f724-11e8-8d64-4e79db33382f_story.html,270,2018-12-04 05:00:23,,False,-0.34,0.179,0.821,0.0
The same bond market move happening now occurred before the last three recessions,politics,1467,a31sdt,https://www.cnbc.com/2018/12/04/the-same-bond-market-move-happening-now-occurred-before-the-last-three-recessions.html,166,2018-12-04 10:44:27,,False,0.0,0.0,1.0,0.0
I Will Not Speak Kindly of the Dead. Bush Was Detestable.,politics,1029,a32z4z,https://truthout.org/articles/i-will-not-speak-kindly-of-the-dead-bush-was-detestable/,203,2018-12-04 12:48:01,,False,-0.7862,0.464,0.536,0.0
Remembering George H.W. Bush’s Inaction on AIDS at Home While Detaining HIV+ Haitians at Guantánamo,politics,3006,a301lx,https://www.democracynow.org/2018/12/3/remembering_george_hw_bushs_inaction_on,313,2018-12-04 06:59:29,,False,-0.25,0.125,0.875,0.0
"Voters in Wisconsin and Michigan protest legislative attempts to undermine newly elected Dems ""Respect our votes!""",politics,1279,a322k7,https://thinkprogress.org/protests-michigan-wisconsin-lame-duck-668e9820a5e1/,32,2018-12-04 11:15:04,,False,-0.1007,0.218,0.631,0.151
C.I.A. Director Briefs Senators on Khashoggi Killing,politics,1092,a32kno,https://www.nytimes.com/2018/12/04/us/politics/cia-senate-khashoggi-.html,72,2018-12-04 12:06:57,,False,-0.6597,0.423,0.577,0.0
"Politically connected sex offender Jeffrey Epstein settles suit, averting victim testimony",politics,1141,a327pw,https://www.politico.com/story/2018/12/04/jeffrey-epstein-settles-suit-testimony-1043176,114,2018-12-04 11:29:54,,False,-0.5574,0.338,0.662,0.0
Democrats prepare to probe Trump's FBI headquarters plan - Rep Connolly,politics,570,a34p7j,https://www.reuters.com/article/us-usa-congress-connolly-fbi-exclusive/exclusive-democrats-prepare-to-probe-trumps-fbi-headquarters-plan-rep-connolly-idUSKBN1O32N7,17,2018-12-04 15:47:27,,False,0.0,0.0,1.0,0.0
Florida Man Claims Sheriff Held Him for ICE for More Than Two Weeks Despite Proof of U.S. Citizenship,politics,855,a333q4,https://slate.com/news-and-politics/2018/12/citizen-detained-florida-sheriff-ice-lawsuit.html,48,2018-12-04 13:01:06,,False,0.0,0.0,1.0,0.0
The Trump Family Is Strangling the American Republic With Conflicts of Interest,politics,957,a32kt1,https://www.esquire.com/news-politics/a25393233/donald-trump-jr-conflict-of-interest/,16,2018-12-04 12:07:25,,False,0.1027,0.167,0.641,0.192
Mueller Is Laying Siege to the Trump Presidency,politics,2799,a2zsii,https://www.theatlantic.com/ideas/archive/2018/12/no-single-news-event-will-take-down-trump/577264/,273,2018-12-04 06:17:12,,False,0.0,0.0,1.0,0.0
"Republicans plan vote Tuesday on curbing powers of Gov.-elect Tony Evers, limiting early voting",politics,1054,a325e9,https://www.jsonline.com/story/news/politics/elections/2018/12/04/republicans-vote-tuesday-curbing-powers-tony-evers-limiting-early-voting/2198624002/,66,2018-12-04 11:23:17,,False,0.0,0.0,1.0,0.0
Good Time To Point Out Voter ID Would Not Stop Republican Election Fraud. Watching the actual voter fraud in North Carolina shows how useless voter ID laws truly are.,politics,450,a34zqu,https://abovethelaw.com/2018/12/good-time-to-point-out-voter-id-would-not-stop-republican-election-fraud/,17,2018-12-04 16:17:25,,False,-0.5736,0.253,0.56,0.187
Trump thought Yellen was too short to be Fed chair. That’s not how any of this works.,politics,1225,a31ihq,https://www.washingtonpost.com/business/2018/12/03/trump-thought-yellen-was-too-short-be-fed-chair-thats-not-how-any-this-works/,71,2018-12-04 10:12:53,,False,0.0,0.0,1.0,0.0
Michael Avenatti: I Won’t Run for President,politics,825,a32p20,https://www.thedailybeast.com/michael-avenatti-i-wont-run-for-president?source=articles&via=rss,303,2018-12-04 12:19:40,,False,0.0,0.0,1.0,0.0
How We Found Donald Trump Jr.’s Secret Investment in a Fundraiser’s Business — ProPublica,politics,698,a335rj,https://www.propublica.org/getinvolved/how-we-found-donald-trump-jr-secret-investment-in-a-fundraiser-business?utm_content=buffer1d680&utm_medium=social&utm_source=twitter&utm_campaign=buffer,13,2018-12-04 13:06:45,,False,0.0,0.0,1.0,0.0
Monumental Disaster at the Department of the Interior,politics,484,a34fea,https://blogs.scientificamerican.com/observations/monumental-disaster-at-the-department-of-the-interior/,13,2018-12-04 15:19:17,,False,-0.6249,0.369,0.631,0.0
"Kellyanne Conway’s husband slams Eric Trump with retweet: ""Did George Conway pay money to have sex with a porn star?""",politics,619,a33g3v,https://www.newsweek.com/kellyanne-conway-husband-eric-trump-donald-1243726,80,2018-12-04 13:38:38,,False,-0.1027,0.072,0.928,0.0
How North Carolina Republicans Allegedly Hatched a Plot to Steal an Election,politics,444,a34oaf,https://www.gq.com/story/north-carolina-election-fraud-harris,16,2018-12-04 15:44:53,,False,-0.4939,0.242,0.758,0.0
Second woman claims she was paid to pick up ballots in U.S. House District 9 race,politics,423,a34qbn,https://www.wsoctv.com/news/local/second-woman-claims-she-was-paid-to-pick-up-ballots-in-us-house-district-9-race/883177036,18,2018-12-04 15:50:48,,False,0.0,0.0,1.0,0.0
"Retaliatory tariffs cost Nebraska agriculture $1 billion, report finds",politics,785,a32jen,https://journalstar.com/news/state-and-regional/govt-and-politics/retaliatory-tariffs-cost-nebraska-agriculture-billion-report-finds/article_71363399-3863-5ed2-81bb-f3dc3391bcea.html,84,2018-12-04 12:03:32,,False,0.0,0.0,1.0,0.0
"After Raucous Hearing, Bills To Restrict Early Voting, Curtail Evers' Powers Move To Full Legislature",politics,1010,a31ovs,https://www.wpr.org/node/1368331,78,2018-12-04 10:33:21,,False,-0.3818,0.157,0.843,0.0
Video of Trump saying DNC should be 'ashamed' for getting hacked resurfaces after NRCC hack revealed,politics,586,a33816,https://www.washingtonexaminer.com/news/video-of-trump-saying-dnc-should-be-ashamed-for-getting-hacked-resurfaces-after-nrcc-hack-revealed,14,2018-12-04 13:16:52,,False,-0.4019,0.153,0.847,0.0
Hoyer: Dems won’t seat Harris until North Carolina fraud allegations are resolved,politics,660,a32whh,https://thehill.com/homenews/house/419658-hoyer-dems-wont-seat-harris-until-north-carolina-fraud-allegations-are,19,2018-12-04 12:40:46,,False,-0.4767,0.245,0.645,0.11
Senators say Gina Haspel’s testimony leaves ‘zero question’: Saudi prince ordered Khashoggi murder The small group of senators were finally briefed by the CIA director on Tuesday.,politics,469,a33zd3,https://thinkprogress.org/senators-gina-haspels-testimony-zero-question-saudi-prince-ordered-khashoggi-murder-665d78610531/,14,2018-12-04 14:33:55,,False,-0.6908,0.153,0.847,0.0
Senators accuse Saudi crown prince of complicity in Khashoggi murder,politics,545,a33ipz,https://www.washingtonpost.com/world/national-security/cia-director-briefs-senators-on-saudi-role-in-khashoggi-killing/2018/12/04/e6d6498c-f7d5-11e8-8d64-4e79db33382f_story.html,47,2018-12-04 13:46:39,,False,-0.7579,0.448,0.552,0.0
Wisconsin Republicans want to ‘maximize their control and minimize yours’,politics,802,a31wa1,http://www.msnbc.com/rachel-maddow-show/wisconsin-republicans-want-maximize-their-control-and-minimize-yours,19,2018-12-04 10:56:21,,False,0.0772,0.0,0.874,0.126
Michael Avenatti’s Campaign Failed Because Democrats Don’t Want Their Own Trump,politics,359,a34g9c,http://nymag.com/intelligencer/2018/12/avenatti-2020-failed-democrats-dont-want-their-own-trump.html,119,2018-12-04 15:21:52,,False,-0.4588,0.243,0.662,0.096
"Lindsey Graham, Republicans Say Saudi Crown Prince Murdered Khashoggi: 'There's Not a Smoking Gun, There's a Smoking Saw’",politics,474,a33jh5,https://www.newsweek.com/republicans-saudi-prince-murdered-khashoggi-smoking-saw-1243989,33,2018-12-04 13:48:48,,False,-0.521,0.215,0.685,0.1
The Trump Team’s Fawning Over Saudi Arabia Is Getting Ridiculous,politics,1744,a2zsxx,https://www.politico.com/magazine/story/2018/12/04/trump-saudi-arabia-222753,38,2018-12-04 06:19:14,,False,-0.3612,0.217,0.783,0.0
"Trump’s plan to shrink national park could drive dozens of unique bees to extinction, study suggests",politics,1256,a30fvw,https://www.independent.co.uk/environment/trump-utah-national-parks-bees-extinction-grand-staircase-escalante-research-a8666271.html,25,2018-12-04 07:56:57,,False,0.0,0.0,1.0,0.0
Democrats double Republicans' fundraising in Tuesday's Georgia runoff.,politics,896,a31ar5,https://politics.myajc.com/news/state--regional-govt--politics/democrats-double-republicans-fundraising-tuesday-georgia-runoff/I83QFEaGbuXRQ9hNLRlDON/,6,2018-12-04 09:48:13,,False,0.0,0.0,1.0,0.0
AP Fact Check: Entire Trump tweet on immigrant aid is wrong,politics,366,a344z3,https://www.apnews.com/762d797a91284a018388ba69fbf703b8,8,2018-12-04 14:49:36,,False,-0.4767,0.237,0.763,0.0
Hakeem Jeffries on GOP operatives in NC fraud probe: 'Lock Them Up',politics,408,a33qai,https://thehill.com/homenews/house/419674-hakeem-jeffries-on-gop-operatives-in-nc-fraud-probe-lock-them-up,12,2018-12-04 14:07:57,,False,-0.5859,0.257,0.743,0.0
Newly-elected GOP congressman admits to breaking federal law,politics,315,a34tbk,https://www.salon.com/2018/12/04/newly-elected-gop-congressman-admits-to-breaking-federal-law/,20,2018-12-04 15:59:26,,False,0.296,0.0,0.761,0.239
"‘What Is the FCC Hiding?' As Net Neutrality Deadline Looms, Agency Refuses FOIA Requests for Crucial Records",politics,342,a34bav,https://www.commondreams.org/news/2018/12/04/what-fcc-hiding-net-neutrality-deadline-looms-agency-refuses-foia-requests-crucial,12,2018-12-04 15:07:50,,False,-0.1531,0.091,0.909,0.0
Graham Breaks With Trump: ‘Zero Chance’ MBS Wasn’t Involved In Khashoggi Murder,politics,387,a33tzn,https://talkingpointsmemo.com/news/graham-breaks-trump-saudi-khashoggi,31,2018-12-04 14:18:32,,False,-0.6908,0.299,0.701,0.0
How George H.W. Bush’s Pardons for Iran-Contra Conspirators Set the Stage for Trump’s Impunity,politics,603,a327ok,https://www.democracynow.org/2018/12/4/how_george_hw_bushs_pardons_for,22,2018-12-04 11:29:45,,False,0.296,0.0,0.855,0.145
Trump administration writes LGBTQ protections out of North American trade deal,politics,558,a32ewf,https://thinkprogress.org/trump-erases-lgbtq-protections-usmca-e4698f729c1f/,39,2018-12-04 11:50:39,,False,0.0,0.0,1.0,0.0
Midwestern Republicans Try To Kneecap New Democratic Governors,politics,1061,a30hz9,https://www.huffingtonpost.com/entry/midwestern-republicans-try-to-kneecap-new-democratic-governors_us_5c05acebe4b0cd916faefc3e,11,2018-12-04 08:05:07,,False,0.0,0.0,1.0,0.0
“What is the FCC hiding?” Pai still won’t release net neutrality server logs,politics,6589,a2wzt9,https://arstechnica.com/tech-policy/2018/12/fcc-still-hiding-possible-evidence-of-russia-meddling-in-net-neutrality-comments/,166,2018-12-03 23:09:47,,False,0.0,0.0,1.0,0.0
Woman says she was paid to collect absentee ballots in North Carolina House race,politics,32364,a2vp31,https://thehill.com/blogs/blog-briefing-room/news/419561-woman-admits-to-picking-up-absentee-ballots-in-north-carolina,1311,2018-12-03 20:39:09,,False,-0.2732,0.139,0.861,0.0
Inside House Democrats’ Plans to Investigate the FCC and Net Neutrality,politics,891,a30uuk,https://www.motherjones.com/politics/2018/12/fcc-ajit-pai-house-democrats-investigations-net-neutrality-sinclair-att/,16,2018-12-04 08:53:53,,False,0.0,0.0,1.0,0.0
Melber: Trump Isn't Sounding Like an Innocent Person,politics,472,a32rj3,https://www.msnbc.com/morning-joe/watch/melber-trump-isn-t-sounding-like-an-innocent-person-1388232259875,43,2018-12-04 12:26:37,,False,0.0747,0.201,0.571,0.228
"Wisconsin Is About to Make a Huge Mistake | The lame duck, heavily gerrymandered Republican Legislature plans to vote on Tuesday to limit the powers of the incoming governor and attorney general, who are — surprise — Democrats.",politics,10170,a2w64d,https://www.nytimes.com/2018/12/03/opinion/wisconsin-legislature-republicans-evers.html,674,2018-12-03 21:33:42,,False,-0.2023,0.131,0.758,0.111
"Saudi crown prince 'ordered, monitored' killing of Khashoggi, Corker says",politics,288,a34bc2,https://www.cnn.com/2018/12/04/politics/haspel-briefing-khashoggi/index.html,27,2018-12-04 15:07:55,,False,-0.6597,0.328,0.672,0.0
Dow tumbles nearly 600 points at low as Tuesday losses gain steam; 10-year yield hits 2.92%,politics,388,a339l7,https://www.marketwatch.com/story/dow-sinks-400-points-in-afternoon-action-as-tuesday-losses-gain-steam-10-year-yield-hits-293-2018-12-04,89,2018-12-04 13:20:41,,False,-0.1027,0.226,0.613,0.16
Schumer: Haspel should brief full Senate on Khashoggi killing,politics,270,a34m2f,https://thehill.com/homenews/senate/419702-schumer-haspel-should-brief-full-senate-on-khashoggi-killing,11,2018-12-04 15:38:23,,False,-0.6597,0.355,0.645,0.0
Mueller's office to recommend sentencing for ex-Trump aide Flynn,politics,1092,a303gw,https://www.reuters.com/article/us-usa-trump-russia-flynn/muellers-office-to-recommend-sentencing-for-ex-trump-aide-flynn-idUSKBN1O3169,56,2018-12-04 07:06:52,,False,0.2263,0.144,0.631,0.225
"The Treasury yield curve just inverted, sounding the alarm for recession",politics,449,a32gcj,https://www.yahoo.com/amphtml/finance/news/treasury-yield-curve-just-inverted-sounding-alarm-recession-194921816.html?__twitter_impression=true,59,2018-12-04 11:55:07,,False,-0.5267,0.347,0.533,0.12
Dow drops more than 800 points on Trump’s ‘Tariff Man’ tweet,politics,273,a345rj,https://nypost.com/2018/12/04/dow-drops-more-than-700-points-on-trumps-tariff-man-tweet/,46,2018-12-04 14:51:54,,False,0.0,0.0,1.0,0.0
"13 Trump entities being subpoenaed in case targeting president’s D.C. hotel, potentially revealing private details of his business",politics,237,a34omi,https://www.washingtonpost.com/business/economy/attorneys-general-issue-subpoenas-to-trump-entities-in-dc-hotel-case/2018/12/04/29e13dc0-f4db-11e8-bc79-68604ed88993_story.html?utm_term=.d7e01b83044e,4,2018-12-04 15:45:45,,False,0.0,0.0,1.0,0.0
"New White House counsel to arrive as Democrats, Mueller close in",politics,235,a34opd,https://www.politico.com/story/2018/12/04/cipollone-new-white-house-counsel-1043868,52,2018-12-04 15:46:01,,False,0.0,0.0,1.0,0.0
“We don’t yet have a specific agreement on that”: White House backtracks on China deal,politics,386,a32w7w,https://www.vox.com/policy-and-politics/2018/12/4/18125472/trump-china-trade-war-xi-auto-tariffs,24,2018-12-04 12:40:00,,False,0.4939,0.0,0.802,0.198
Dow sinks 700 points as trade truce enthusiasm fades,politics,328,a33hlf,https://www.cnn.com/2018/12/04/investing/stock-market-today-dow-jones/index.html,41,2018-12-04 13:43:28,,False,0.4404,0.0,0.734,0.266
Trump's Aides Struggle to Detail Deal He Says He Cut With Xi,politics,711,a30xoh,https://www.bloomberg.com/news/articles/2018-12-03/trump-s-advisers-struggle-to-explain-deal-he-says-he-cut-with-xi?srnd=premium,60,2018-12-04 09:04:06,,False,-0.5267,0.306,0.694,0.0
Morning Joe compiles all the times Trump awkwardly wandered away from an event,politics,499,a31vq7,https://theweek.com/speedreads/810784/morning-joe-compiles-all-times-trump-awkwardly-wandered-away-from-event,23,2018-12-04 10:54:44,,False,-0.3182,0.161,0.839,0.0
