title,subreddit,score,id,url,num_comments,created_utc,selftext,over_18,compound,neg,neu,pos
Schiff: Roger Stone could face charges of lying to Congress,politics,2016,a2jot0,https://thehill.com/blogs/blog-briefing-room/news/419379-schiff-roger-stone-could-face-charges-of-lying-to-congress,55,2018-12-02 20:31:58,,False,-0.6705,0.407,0.593,0.0
Republicans Recommit to Trump's Impunity,politics,66,a2sj0z,https://crooked.com/articles/republicans-trump-impunity/,7,2018-12-03 15:19:42,,False,0.0,0.0,1.0,0.0
How Climate Change Is Driving Central American Migrants to the United States,politics,80,a2s06k,https://www.texasobserver.org/climate-change-migration-central-america-united-states/,2,2018-12-03 14:27:30,,False,0.4215,0.0,0.797,0.203
Ocasio-Cortez says ‘death panels’ exist in private health insurance market,politics,28406,a2fjvj,https://thehill.com/homenews/house/419349-ocasio-cortez-says-death-panels-now-exist-in-health-care,2927,2018-12-02 13:10:26,,False,0.0,0.0,1.0,0.0
"Mehdi Hasan on George H.W. Bush’s Ignored Legacy: War Crimes, Racism and Obstruction of Justice",politics,93,a2r7qv,https://www.democracynow.org/2018/12/3/mehdi_hasan_on_george_hw_bushs,5,2018-12-03 13:08:52,,False,-0.7845,0.417,0.445,0.138
The Mueller Investigation Grows More Ominous for Trump and His Inner Circle,politics,3707,a2hv69,https://www.motherjones.com/politics/2018/12/robert-mueller-investigation-trump-russia-michael-cohen/,159,2018-12-02 17:04:28,,False,-0.4005,0.197,0.803,0.0
How a future Trump Cabinet member gave a serial sex abuser the deal of a lifetime,politics,2830,a2ikhr,https://www.miamiherald.com/news/local/article220097825.html?fbclid=IwAR0pZ5QIbgyVzR3ltXTFRXuWtTScjzZSUHDMJynPmR5-Q_kbwITgh2XRvPk,111,2018-12-02 18:21:52,,False,-0.5574,0.231,0.769,0.0
"Newsom vows to withdraw Guard from border, seeks help for humanitarian crisis",politics,62,a2so48,https://www.politico.com/states/california/story/2018/12/01/newsom-vows-to-withdraw-guard-from-border-seeks-help-for-humanitarian-crisis-721863,4,2018-12-03 15:33:59,,False,-0.34,0.244,0.595,0.161
VA Shadow Rulers Had Sway Over Contracting and Budgeting,politics,310,a2nohl,https://www.propublica.org/article/va-shadow-rulers-had-sway-over-contracting-and-budgeting,18,2018-12-03 06:04:08,,False,0.0,0.0,1.0,0.0
GOP Senate leader Scott Fitzgerald: 'We don’t trust Tony Evers right now',politics,50,a2spv1,https://www.jsonline.com/story/news/politics/2018/12/03/gop-senate-leader-scott-fitzgerald-we-dont-trust-tony-evers-right-now/2191923002/,24,2018-12-03 15:38:44,,False,0.5106,0.0,0.769,0.231
"‘Bipartisan’ Group No Labels Sought Donations From Peter Thiel, David Koch",politics,111,a2qbjn,https://www.thedailybeast.com/bipartisan-group-no-labels-sought-donations-from-peter-thiel-david-koch,9,2018-12-03 11:39:30,,False,-0.296,0.18,0.82,0.0
DNC plans top donor summit ahead of 2020,politics,0,a354rf,https://www.politico.com/story/2018/12/04/dnc-top-donors-2020-1044589,6,2018-12-04 16:31:35,,False,0.2023,0.0,0.795,0.205
Stephen King Draws Startling Comparison Between Trump And George H.W. Bush,politics,51,a2su7x,https://www.huffingtonpost.com/entry/stephen-king-george-bush-sr-trump_us_5c056a6fe4b0cd916faead17,8,2018-12-03 15:50:32,,False,0.0772,0.0,0.885,0.115
"In the Blink of an Eye, a Hunt for Oil Threatens Pristine Alaska",politics,119,a2qbko,https://www.nytimes.com/2018/12/03/us/oil-drilling-arctic-national-wildlife-refuge.html?action=click&module=Top%20Stories&pgtype=Homepage,3,2018-12-03 11:39:35,,False,-0.3818,0.191,0.809,0.0
"Kentucky congressman questions food stamps: ‘If healthcare is a right, is food as well?’",politics,4804,a2gv33,https://www.marketwatch.com/story/kentucky-congressman-questions-food-stamps-if-healthcare-is-a-right-is-food-as-well-2018-11-29,807,2018-12-02 15:23:56,,False,0.0,0.0,1.0,0.0
Trump wants ‘full and complete’ sentence for Cohen,politics,113,a2q33d,https://www.washingtonpost.com/politics/trump-wants-full-and-complete-sentence-for-cohen/2018/12/03/38202328-f716-11e8-8642-c9718a256cbd_story.html,23,2018-12-03 11:15:21,,False,0.0772,0.0,0.843,0.157
Video: Naomi Klein Interviews Bernie Sanders on Climate Change.,politics,59,a2sewe,https://theintercept.com/2018/12/03/bernie-sanders-climate-change-naomi-klein/,3,2018-12-03 15:08:05,,False,0.0,0.0,1.0,0.0
The world’s tyrants are laughing at Trump — and America,politics,1356,a2k5d4,https://www.washingtonpost.com/opinions/trump-may-have-had-his-most-successful-outing-at-g-20-but-he-didnt-accomplish-much/2018/12/02/fd54526c-f66d-11e8-8c9a-860ce2a8148f_story.html,48,2018-12-02 21:27:21,,False,0.4939,0.0,0.714,0.286
New Michigan marijuana law getting rewrite from State Senate Republicans,politics,185,a2ojpl,https://www.abc12.com/content/news/New-Michigan-marijuana-law-getting-rewrite-from-State-Senate-Republicans-501674662.html,30,2018-12-03 08:16:45,,False,0.0,0.0,1.0,0.0
Jamal Khashoggi's private WhatsApp messages may offer new clues to killing,politics,4405,a2gvl2,https://www.cnn.com/2018/12/02/middleeast/jamal-khashoggi-whatsapp-messages-intl/index.html,165,2018-12-02 15:25:16,,False,-0.6597,0.306,0.694,0.0
"Is the US ""Flirting With Fascism""?",politics,165,a2oqi9,https://truthout.org/articles/is-the-us-flirting-with-fascism/,55,2018-12-03 08:41:32,,False,0.2023,0.0,0.735,0.265
Bush family seeks to steer clear of anti-Trump sentiment at 41st president’s funeral,politics,14,a2xggh,https://www.washingtonpost.com/politics/bush-family-seeks-to-steer-clear-of-anti-trump-sentiment-at-41st-presidents-funeral/2018/12/03/1bfe5828-f738-11e8-8c9a-860ce2a8148f_story.html?utm_term=.19c094e61571,34,2018-12-04 00:07:19,,False,0.0258,0.155,0.683,0.161
There’s No Real Difference Between Border Walls and Border Fences,politics,27,a2uu42,https://www.aclu.org/blog/immigrants-rights/theres-no-real-difference-between-border-walls-and-border-fences,11,2018-12-03 19:00:27,,False,-0.296,0.196,0.804,0.0
Militia Leader Ammon Bundy Criticizes Donald Trump’s Rhetoric On Immigrants : 'It’s All Fear-Based’,politics,1768,a2j6af,https://www.newsweek.com/right-wing-militia-leader-blasts-trump-migrant-rhetoric-1235095,214,2018-12-02 19:31:13,,False,-0.34,0.167,0.833,0.0
Wisconsin Republicans forge ahead with power-stripping bills,politics,562,a2m4fe,https://www.washingtonpost.com/national/republicans-prepare-to-move-ahead-with-lame-duck-session/2018/12/02/8baefe0a-f695-11e8-8642-c9718a256cbd_story.html,62,2018-12-03 01:42:59,,False,0.0,0.0,1.0,0.0
US to transfer ships to Ukraine amid Russia tensions,politics,34,a2tls9,https://www.kimt.com/content/national/494258301.html,8,2018-12-03 17:01:31,,False,-0.4019,0.252,0.748,0.0
Supporters of criminal justice reform frustrated with McConnell's handling of bill,politics,59,a2rspl,https://abcnews.go.com/Politics/supporters-criminal-justice-reform-frustrated-mcconnells-handling-bill/story?id=59574789,12,2018-12-03 14:06:44,,False,-0.128,0.338,0.348,0.313
Maine's Bruce Poliquin is suing to overturn the results of the election he lost,politics,169,a2ohkq,https://www.pressherald.com/2018/12/03/ranked-choice-voting-put-to-national-test/,16,2018-12-03 08:08:44,,False,-0.5267,0.268,0.732,0.0
Mail delivery suspended Wednesday for national day of mourning for George H.W. Bush,politics,23,a2ve4u,https://www.krqe.com/news/mail-delivery-suspended-wednesday-for-national-day-of-mourning-for-george-hw-bush/1637520035,35,2018-12-03 20:04:11,,False,-0.7184,0.353,0.647,0.0
"Congress plans to delay shutdown deadline, border wall fight until the Friday before Christmas",politics,70,a2rawf,https://www.cnbc.com/2018/12/03/congress-to-delay-government-shutdown-date-trump-border-wall-fight.html,15,2018-12-03 13:17:40,,False,-0.5994,0.29,0.71,0.0
Fox News Loves Trump. Dems Want To Complicate That Marriage.,politics,271,a2nhrc,https://www.thedailybeast.com/fox-news-loves-trump-dems-want-to-complicate-that-marriage?via=mobile&source=Reddit,15,2018-12-03 05:31:48,,False,0.6124,0.0,0.615,0.385
The Energy 202: Senate Republicans are sounding more and more like Trump on climate change,politics,115,a2phgu,https://www.washingtonpost.com/news/powerpost/paloma/the-energy-202/2018/12/03/the-energy-202-senate-republicans-are-sounding-more-and-more-like-trump-on-climate-change/5c0437761b326b60d12800d4/,6,2018-12-03 10:10:13,,False,0.6318,0.0,0.716,0.284
"Trump praises Roger Stone's 'guts,' slams former lawyer for cooperating with Mueller",politics,78,a2qvrz,https://www.cnn.com/2018/12/03/politics/donald-trump-roger-stone-guts-robert-mueller-michael-cohen-tweets/index.html,13,2018-12-03 12:37:33,,False,0.5267,0.0,0.764,0.236
Bernie Sanders looks set to launch 'bigger' 2020 presidential bid,politics,74,a2r8e8,https://www.independent.co.uk/news/world/americas/us-politics/bernie-sanders-presidential-bid-campaign-2020-democrats-white-house-a8664426.html,365,2018-12-03 13:10:39,,False,0.0,0.0,1.0,0.0
When C.E.O.s Cared About America,politics,223,a2nv2j,https://www.nytimes.com/2018/12/02/opinion/elizabeth-warren-2020-accountable-capitalism.html,35,2018-12-03 06:34:26,,False,0.4215,0.0,0.588,0.412
Trump’s tweets about loyalty aren’t necessarily helping him.,politics,40,a2svn6,https://newrepublic.com/minutes/152490/trumps-tweets-loyalty-arent-necessarily-helping-him,1,2018-12-03 15:54:17,,False,0.6908,0.0,0.513,0.487
Trump’s Labor Secretary Once Helped a Billionaire Child Rapist Hide His Crimes,politics,9428,a2esw8,https://www.thecut.com/2018/11/epstein-plea-acosta-miami-herald-investigation-sex-crimes-trump-clinton.html,544,2018-12-02 11:52:52,,False,-0.765,0.423,0.577,0.0
Rally Planned to Protest “Republican Power Grab”,politics,5615,a2fqbp,https://madison365.com/rally-planned-to-protest-republican-power-grab/,102,2018-12-02 13:29:14,,False,-0.25,0.25,0.75,0.0
Alexandria Ocasio-Cortez says all Americans should have the affordable healthcare she now gets as a congresswoman,politics,48823,a2edr8,https://www.newsweek.com/ocasio-cortez-rebukes-lawmakers-healthcare-hypocrisy-1240258,3811,2018-12-02 11:06:04,,False,0.0,0.0,1.0,0.0
Trump’s car tariff deal with China is better for other countries,politics,29,a2ty8t,https://www.vox.com/world/2018/12/3/18124426/trump-china-car-deal-tariff-trade-war,4,2018-12-03 17:32:53,,False,0.4404,0.0,0.775,0.225
Trump handles Bush's death with abnormal normality,politics,13,a2wzif,https://www.politico.com/story/2018/12/03/trump-response-bush-death-1041328,44,2018-12-03 23:08:46,,False,-0.5994,0.394,0.606,0.0
How the FIRST STEP ACT Moves Criminal Justice Reform Forward,politics,35,a2tfkn,https://www.aclu.org/blog/smart-justice/mass-incarceration/how-first-step-act-moves-criminal-justice-reform-forward,3,2018-12-03 16:45:23,,False,0.0,0.23,0.541,0.23
Town hall meeting in Babylon on legalizing marijuana in New York,politics,39,a2sodx,https://abc7ny.com/politics/town-hall-meeting-in-babylon-on-legalizing-marijuana/4819901/,18,2018-12-03 15:34:42,,False,0.0,0.0,1.0,0.0
Opinion | Another conflict of interest at a Trump hotel?,politics,51,a2rq0g,https://www.washingtonpost.com/opinions/2018/11/29/another-conflict-interest-trump-hotel/,2,2018-12-03 13:59:30,,False,0.1779,0.204,0.531,0.265
"Chip wars: China, America and silicon supremacy",politics,13,a2wd18,https://www.economist.com/leaders/2018/12/01/chip-wars-china-america-and-silicon-supremacy,9,2018-12-03 21:55:25,,False,-0.5267,0.367,0.51,0.122
Black Women Decided The 2016 Democratic Nominee. They’ll Have An Even Bigger Say In 2020.,politics,53,a2rnvn,https://www.buzzfeednews.com/article/bensmith/black-women-primary-2020-kamala-deval-booker,43,2018-12-03 13:53:33,,False,0.0,0.0,1.0,0.0
Last four years are 'world's hottest',politics,258,a2n9rz,https://www.bbc.co.uk/news/science-environment-46374141?intlink_from_url=https://www.bbc.co.uk/news/topics/cmj34zmwm1zt/climate-change&link_location=live-reporting-story,50,2018-12-03 04:53:51,,False,0.0,0.0,1.0,0.0
The “Trump effect” threatens the future of the Paris climate agreement,politics,44,a2s6qr,https://www.vox.com/energy-and-environment/2018/12/3/18123310/cop24-trump-paris-climate-agreement,2,2018-12-03 14:45:33,,False,0.1531,0.176,0.608,0.216
Jerome Corsi files formal complaint against Mueller,politics,31,a2tmoe,https://www.nbcnews.com/politics/justice-department/jerome-corsi-files-formal-complaint-against-mueller-n943076,34,2018-12-03 17:03:50,,False,-0.296,0.268,0.732,0.0
Saudi friend of Khashoggi sues Israeli surveillance company,politics,139,a2oi01,https://www.apnews.com/ca8d2394c1694bbcac85744dab5cc5bf,2,2018-12-03 08:10:20,,False,0.4939,0.0,0.686,0.314
"Despite big GOP losses in Maine, Collins isn’t worried about 2020",politics,136,a2om6q,https://bangordailynews.com/2018/12/02/politics/despite-big-gop-losses-in-maine-collins-isnt-worried-about-2020/,50,2018-12-03 08:25:47,,False,0.015,0.163,0.669,0.168
Florida hurt by inaction on climate change,politics,98,a2pg0p,https://www.gainesville.com/opinion/20181202/editorial-florida-hurt-by-inaction-on-climate-change,12,2018-12-03 10:05:35,,False,-0.6597,0.519,0.481,0.0
For Sale: Border Wall. Illegally Erected.,politics,62,a2qtpg,https://www.rollingstone.com/politics/politics-features/new-mexico-border-land-sale-762452/,3,2018-12-03 12:32:14,,False,0.0,0.0,1.0,0.0
House Democratic leader pledges end to ‘witch hunt’ against environmental groups,politics,57,a2qsur,https://thinkprogress.org/house-democratic-leader-pledges-end-to-witch-hunt-against-environmental-groups-e011e256bd90/,2,2018-12-03 12:29:13,,False,0.0,0.0,1.0,0.0
Trump administration organizes pushback against its own climate report,politics,74,a2q08t,https://arstechnica.com/science/2018/12/trump-administration-organizes-pushback-against-its-own-climate-report/,6,2018-12-03 11:07:05,,False,0.0,0.0,1.0,0.0
Ocasio-Cortez blasts for-profit 'death panels' in response to criticism of social healthcare,politics,3303,a2gc8f,https://www.newsweek.com/ocasio-cortez-blasts-profit-death-panels-response-criticism-social-healthcare-1240397,217,2018-12-02 14:30:50,,False,-0.7783,0.405,0.595,0.0
Schiff: Trump refusal to rule out Manafort pardon adds to evidence of obstruction of justice,politics,8332,a2e5k1,https://thehill.com/homenews/sunday-talk-shows/419329-schiff-trump-refusal-to-rule-out-manafort-pardon-adds-to-potential,394,2018-12-02 10:38:30,,False,0.6908,0.0,0.695,0.305
Did Trump meet with Putin at G20? White House confirms surprise 'informal' meeting with Russian leader,politics,2116,a2hl5w,https://www.newsweek.com/did-trump-meet-putin-g20-white-confirms-surprise-informal-meeting-russian-1240198,110,2018-12-02 16:35:59,,False,0.2732,0.0,0.877,0.123
"Trump's Enemies review: president's pitbulls come out brawling and bawling| Corey Lewandowski and David Bossie are snarling Trump ultras, determined to boost their belligerent ex-boss",politics,23,a2tw9f,https://www.theguardian.com/us-news/2018/dec/03/trumps-enemies-book-review-corey-lewandowski-david-bossie,2,2018-12-03 17:27:56,,False,0.2263,0.106,0.726,0.168
Donald Trump: The Neville Chamberlain of trade,politics,26,a2t3o1,http://www.aei.org/publication/donald-trump-the-neville-chamberlain-of-trade/,4,2018-12-03 16:15:08,,False,0.0,0.0,1.0,0.0
The US might end up tolerating India’s $5 billion deal for Russian missile systems,politics,29,a2sys5,https://www.cnbc.com/2018/12/03/us-might-tolerate-indias-5-billion-deal-for-russian-missile-systems.html,4,2018-12-03 16:02:09,,False,0.0,0.0,1.0,0.0
ICE Is Keeping Immigrants Locked Up for Months Before They See a Judge,politics,877,a2jyrt,https://www.nyclu.org/en/news/ice-keeping-immigrants-locked-months-they-see-judge,32,2018-12-02 21:05:19,,False,0.0,0.0,1.0,0.0
Trump says country 'would save billions' if Democrats agreed to fund border wall,politics,27,a2sfmw,https://thehill.com/homenews/administration/419417-trump-says-country-would-save-billions-if-democrats-agreed-to-fund?,41,2018-12-03 15:10:08,,False,0.6486,0.0,0.675,0.325
Trump refuses to answer when questioned about insults and criticism of George H.W. Bush and Family,politics,5876,a2emah,https://www.newsweek.com/trump-refuses-answer-when-questioned-about-insults-and-criticism-george-hw-1240184,502,2018-12-02 11:32:58,,False,-0.7269,0.353,0.647,0.0
ICE threatens New Jersey with more raids after implementing pro-immigrant policy,politics,58,a2qfx3,https://thinkprogress.org/ice-threatens-nj-with-more-raids-85daa37650f0/,6,2018-12-03 11:52:24,,False,-0.3818,0.206,0.794,0.0
"Trump’s daffy, dangerous climate change denial",politics,95,a2ouqf,https://www.azcentral.com/story/opinion/op-ed/ej-montini/2018/12/01/donald-trump-climate-change-denial-global-warming/2164373002/,2,2018-12-03 08:57:04,,False,-0.4767,0.383,0.617,0.0
Flag over downtown Portland building is aimed at Sen. Collins,politics,78,a2pkqf,https://www.pressherald.com/2018/12/03/building-owner-wont-furl-his-dismay-over-sen-collins/,8,2018-12-03 10:20:26,,False,0.0,0.0,1.0,0.0
Dershowitz says he's still advising Jeffrey Epstein,politics,1063,a2jcsi,https://www.axios.com/newsletters/axios-sneak-peek-570398b2-a21c-428e-a8f8-a7d3dabeb30e.html?chunk=5&utm_term=twsocialshare#story5,103,2018-12-02 19:52:13,,False,0.0,0.0,1.0,0.0
Trump Admin OKs Underwater Seismic Blasts That Could Severely Hurt Marine Life,politics,2356,a2gxxg,https://www.huffingtonpost.com/entry/seismic-testing-oil-animals-atlantic-ocean_us_5c02eb39e4b0606a15b5d5c5,74,2018-12-02 15:31:41,,False,-0.7506,0.39,0.61,0.0
"Trump's Political Risk Spreads to Small-Town America, Poll Finds",politics,63,a2q8k5,https://www.bloomberg.com/amp/news/articles/2018-12-03/trump-s-political-risk-spreads-to-small-town-america-poll-finds,2,2018-12-03 11:31:01,,False,-0.2732,0.208,0.792,0.0
Rand Paul blasts ‘deep state’ for shutting him out of CIA briefing,politics,0,a35c0g,https://www.politico.com/story/2018/12/04/rand-paul-blasts-getting-shut-out-of-cia-briefing-1043386,7,2018-12-04 16:52:09,,False,0.0,0.0,1.0,0.0
CIA intercepts implicate Saudi prince in killing of critic,politics,469,a2lhc5,https://www.sfgate.com/world/article/CIA-intercepts-Saudi-prince-in-killing-Khashoggi-13438371.php?utm_campaign=reddit-mobile&utm_source=CMS%20Sharing%20Button&utm_medium=social,10,2018-12-03 00:13:02,,False,-0.7579,0.481,0.519,0.0
Qatar will pull out of OPEC amid tension with Saudi Arabia,politics,129,a2o4tf,https://abcnews.go.com/International/wireStory/qatars-energy-minister-country-pulling-opec-59569080,8,2018-12-03 07:17:41,,False,-0.3182,0.187,0.813,0.0
"Senators, union press GM CEO on plant closings, job cuts",politics,20,a2u9mp,https://www.reuters.com/article/us-gm-restructuring-idUSKBN1O22GG?utm_campaign=trueAnthem:+Trending+Content&utm_content=5c05b32b04d301168b680bf1&utm_medium=trueAnthem&utm_source=twitter,9,2018-12-03 18:02:04,,False,-0.296,0.196,0.804,0.0
Newly-Elected Congressman Says He May Have Broken Campaign Finance Law,politics,71,a2piui,http://www.rollcall.com/news/politics/newly-elected-congressman-says-may-broken-campaign-finance-law,15,2018-12-03 10:14:25,,False,-0.4767,0.256,0.744,0.0
Corsi Files Complaint With DOJ Alleging Mueller Misconduct,politics,44,a2qyeh,https://www.courthousenews.com/corsi-files-complaint-with-doj-alleging-muller-misconduct/,48,2018-12-03 12:43:16,,False,-0.296,0.239,0.761,0.0
President Trump gives in to China and agrees to suspend adding new tariffs,politics,602,a2kn52,https://www.newsweek.com/trump-gives-china-agrees-suspend-adding-new-tariffs-1240308,61,2018-12-02 22:26:04,,False,-0.128,0.152,0.728,0.119
President Bush and the Road to Trumpism,politics,48,a2quxo,https://talkingpointsmemo.com/edblog/president-bush-and-the-road-to-trumpism,8,2018-12-03 12:35:53,,False,0.0,0.0,1.0,0.0
Why does it take a voice from the hereafter to make Republicans do the right thing?,politics,25,a2shkp,https://www.cnn.com/2018/12/03/opinions/can-george-hw-bush-can-make-republicans-do-the-right-thing-kohn/index.html,17,2018-12-03 15:15:37,,False,0.0,0.0,1.0,0.0
"Cotton opposes bill to trim prison terms, calls it too lenient",politics,56,a2pz0g,https://www.arkansasonline.com/news/2018/dec/02/cotton-opposes-bill-to-trim-prison-term/,14,2018-12-03 11:03:38,,False,-0.296,0.229,0.625,0.146
Lock him up! President Trump wants Michael Cohen to do full prison time,politics,51,a2qm9w,https://www.nydailynews.com/news/politics/ny-pol-trump-cohen-prison-mueller-20181203-story.html,10,2018-12-03 12:10:20,,False,-0.5562,0.23,0.77,0.0
"‘Fake news’ could destroy Western society, State Department official warns",politics,1941,a2h4lg,https://www.yahoo.com/news/fake-news-destroy-western-society-state-department-official-warns-162544953.html,151,2018-12-02 15:49:53,,False,-0.5994,0.38,0.62,0.0
Obama aides say Beto O'Rourke reminds them of the ex-president. Obama agrees.,politics,12467,a2dab6,https://www.nbcnews.com/politics/elections/obama-aides-say-beto-o-rourke-reminds-them-ex-president-n942576?cid=public-rss_20181202,1051,2018-12-02 08:43:23,,False,0.2023,0.0,0.859,0.141
Pollster says climate change more likely to be presented as global issue in polls,politics,24,a2skty,https://thehill.com/hilltv/what-americas-thinking/419500-pollster-says-climate-change-more-likely-to-be-presented-as,3,2018-12-03 15:24:40,,False,0.0,0.0,1.0,0.0
Trump overheard saying 'get me out of here' as he suddenly walks off stage at G20 summit,politics,52208,a2d37k,https://www.independent.co.uk/news/world/americas/trump-g20-video-watch-stage-hot-mic-mauricio-macri-summit-argentina-buenos-aires-a8663486.html,5854,2018-12-02 08:12:37,,False,0.0,0.0,1.0,0.0
Trump takes on General Motors (guess who wins?),politics,108,a2og8r,https://www.theguardian.com/commentisfree/2018/dec/03/general-motors-trump-jobs-shareholders,15,2018-12-03 08:03:57,,False,0.0,0.0,1.0,0.0
New Momentum in Veterans' Fight for Medical Marijuana,politics,30,a2rxau,https://www.usnews.com/news/best-states/new-jersey/articles/2018-12-02/new-momentum-in-veterans-fight-for-medical-marijuana,1,2018-12-03 14:19:27,,False,-0.3818,0.271,0.729,0.0
Adam Schiff Suggests Roger Stone Lied to Congress,politics,3450,a2fa22,https://www.thedailybeast.com/adam-schiff-suggests-roger-stone-lied-to-congress?via=desktop&source=Reddit,85,2018-12-02 12:42:37,,False,-0.3818,0.271,0.729,0.0
Top Democrats raise alarms about Trump's project in Russia that he called 'very legal & very cool',politics,1326,a2i4m0,https://www.nbcnews.com/politics/donald-trump/top-democrats-raise-alarms-about-trump-s-project-russia-he-n942791,39,2018-12-02 17:32:25,,False,0.5187,0.102,0.584,0.314
Trump says he wants Michael Cohen to receive a 'full and complete sentence',politics,46,a2qcam,https://www.businessinsider.com/trump-says-he-wants-cohen-to-receive-a-full-and-complete-sentence-2018-12,17,2018-12-03 11:41:39,,False,0.0772,0.0,0.894,0.106
"Trump to Attend Bush Funeral, but Won’t Deliver Eulogy",politics,32,a2rrv8,https://www.nytimes.com/2018/12/03/us/politics/trump-george-bush-capitol.html,50,2018-12-03 14:04:24,,False,-0.1901,0.179,0.821,0.0
"The Climate Apocalypse Is Now, and It’s Happening to You",politics,3394,a2f7iv,https://www.wired.com/story/the-climate-apocalypse-is-now-and-its-happening-to-you/,374,2018-12-02 12:35:46,,False,0.0,0.0,1.0,0.0
Bernie Sanders 2020? Senator mulls second White House run,politics,71,a2p38i,https://www.theguardian.com/us-news/2018/dec/03/bernie-sanders-2020-president-senator-mulls-second-white-house-run,267,2018-12-03 09:25:22,,False,0.0,0.0,1.0,0.0
Northern Virginia men accused of swindling billions from Pentagon,politics,511,a2kq79,https://wtop.com/fairfax-county/2018/12/northern-virginia-men-accused-of-swindling-billions-from-pentagon/,45,2018-12-02 22:36:25,,False,-0.6369,0.426,0.574,0.0
The US got its own section in the G20 statement on climate change,politics,45,a2ql1x,https://www.vox.com/policy-and-politics/2018/12/3/18123684/trump-g20-climate-change-paris-agreement,4,2018-12-03 12:06:58,,False,0.0,0.0,1.0,0.0
Analysis | The Daily 202: A quartet of Democratic women now lead party committees,politics,19,a2tfgo,https://www.washingtonpost.com/news/powerpost/paloma/daily-202/2018/12/03/daily-202-a-quartet-of-democratic-women-now-lead-party-committees/5c044f971b326b60d12800d7/,1,2018-12-03 16:45:07,,False,0.4019,0.0,0.803,0.197
Klobuchar returns to Iowa as she mulls 2020 presidential bid,politics,45,a2qcf2,https://www.mprnews.org/story/2018/12/02/klobuchar-returns-iowa-mulls-2020-presidential-bid?fbclid=IwAR3_sgaThTSqf4yfopXdFVXafk169TqBmeuAkzvhKjbkBISjiLecb21vQag,48,2018-12-03 11:42:05,,False,0.0,0.0,1.0,0.0
We have a new worst-case scenario for Obamacare,politics,19,a2tf06,https://www.vox.com/policy-and-politics/2018/12/3/18124353/new-worst-case-scenario-obamacare,2,2018-12-03 16:44:02,,False,0.0,0.0,1.0,0.0
Insecure Men Were a Big Trump Demographic in 2016,politics,12589,a2dbgh,https://www.motherjones.com/kevin-drum/2018/11/insecure-men-were-a-big-trump-demographic-in-2016/,1970,2018-12-02 08:48:05,,False,-0.4215,0.286,0.714,0.0
"John Dingell, longest-serving congressman, wants to 'abolish the Senate'",politics,0,a359d7,https://www.washingtontimes.com/news/2018/dec/4/john-dingell-longest-serving-congressman-wants-to-/,6,2018-12-04 16:44:58,,False,0.0,0.0,1.0,0.0
CIA Director Will Brief Lawmakers on Assassination of Saudi Journalist,politics,18,a2tka9,https://www.nationalreview.com/news/cia-director-will-brief-lawmakers-on-assassination-of-saudi-journalist/amp/#click=https://t.co/pgkEK2saA9,8,2018-12-03 16:57:33,,False,-0.5994,0.302,0.698,0.0
Mattis reveals Russian government attempted to interfere in U.S. midterm elections earlier this month,politics,4132,a2ejct,https://abcnews.go.com/International/mattis-reveals-russian-government-attempted-interfere-us-midterm/story?id=59551008,126,2018-12-02 11:24:00,,False,0.0,0.0,1.0,0.0
Flake: 'I think there will be' enough Senate votes to stop a presidential veto of resolution to cut US support to the Saudis in Yemen,politics,5966,a2drxo,https://edition.cnn.com/2018/11/30/politics/jeff-flake-us-saudi-arabia-yemen-policy-cnntv/index.html,214,2018-12-02 09:49:55,,False,-0.1531,0.154,0.75,0.096
