title,subreddit,score,id,url,num_comments,created_utc,selftext,over_18,compound,neg,neu,pos
"After backing more military spending for 2 years, Trump now complains it’s too high",politics,527,a2v378,https://www.marketwatch.com/discover?url=https%3A%2F%2Fwww.marketwatch.com%2Famp%2Fstory%2Fguid%2F5c24bdf2-f74c-11e8-84a6-e0b25e1938b1&link=sfmw_tw#https://www.marketwatch.com/amp/story/guid/5c24bdf2-f74c-11e8-84a6-e0b25e1938b1?mod=dist_amp_social,36,2018-12-03 19:28:57,,False,-0.3612,0.177,0.748,0.075
Big wins on ballot proposals don't deter GOP from going after changes,politics,53,a30m1s,https://www.freep.com/story/news/politics/2018/11/30/gop-ignores-voters-pot-gerrymandering-voting-access/2163640002/,4,2018-12-04 08:20:57,,False,0.5719,0.0,0.748,0.252
Fox News Wants You to Know That Even One Toke Will Result in Fatal Levels of Chill,politics,1793,a2r02l,https://www.esquire.com/news-politics/a25379291/fox-news-marijuana-sheriff-reefer-madness/,206,2018-12-03 12:47:40,,False,-0.5423,0.179,0.821,0.0
"Alexandria Ocasio-Cortez: Capitol Hill staff and interns need ""living wage""",politics,600,a2un5e,https://www.cbsnews.com/news/alexandria-ocasio-cortez-capitol-hill-staff-and-interns-need-living-wage/,81,2018-12-03 18:39:40,,False,0.0,0.0,1.0,0.0
Cummings: Kemp Should Testify About Voter Suppression Allegations,politics,754,a2ttdv,https://thehill.com/homenews/campaign/419535-cummings-kemp-should-testify-about-voter-suppression-allegations,9,2018-12-03 17:20:30,,False,0.0,0.0,1.0,0.0
Grassley offers Trump some advice on his tweets: Show them to your wife first,politics,16,a33npi,https://www.washingtonpost.com/politics/grassley-offers-trump-some-advice-on-his-tweets-show-them-to-your-wife-first/2018/12/04/91200d58-f7f2-11e8-8c9a-860ce2a8148f_story.html?utm_term=.11d045be40eb,11,2018-12-04 14:00:44,,False,0.0,0.0,1.0,0.0
‘Who is Scott Free?’ A search for meaning after Trump’s misuse of a medieval idiom.,politics,29,a31zou,https://www.washingtonpost.com/nation/2018/12/04/who-is-scott-free-search-meaning-after-trumps-misuse-medieval-idiom/?noredirect=on&utm_term=.568921e6c095,10,2018-12-04 11:06:18,,False,0.0,0.0,1.0,0.0
Elections leader named to probe North Carolina Congress race,politics,35,a31kmg,https://www.cbsnews.com/news/elections-leader-named-to-probe-north-carolina-congress-race/,2,2018-12-04 10:19:42,,False,0.0,0.0,1.0,0.0
Charlottesville prosecutors seek to use Hitler image texted to mother in James Alex Fields’ trial,politics,33,a31dgr,https://wtop.com/virginia/2018/12/prosecutors-seek-to-use-hitler-image-texted-to-mother-in-james-alex-fields-murder-trial/,7,2018-12-04 09:57:27,,False,0.0,0.0,1.0,0.0
"""Tariff Man"" Donald Trump threatens China if deal doesn't work, internet explodes with jokes and memes",politics,27,a32ldu,https://www.newsweek.com/tariff-man-donald-trump-meme-1243518,6,2018-12-04 12:09:07,,False,-0.1531,0.14,0.753,0.108
The Art of the Underwhelming Deal,politics,50,a30ke2,https://newrepublic.com/article/152498/trump-china-art-underwhelming-deal,5,2018-12-04 08:14:09,,False,0.0,0.0,1.0,0.0
Mueller's breadcrumbs suggest he has the goods,politics,5085,a2o7kb,https://www.axios.com/mueller-investigation-report-details-court-filings-2511dd33-1928-4431-a9bb-09488ee216ef.html,419,2018-12-03 07:29:12,,False,0.0,0.0,1.0,0.0
"In blow to Sinclair, Nexstar announces $4.1 billion deal acquisition of Tribune",politics,1451,a2riqj,https://www.salon.com/2018/12/03/in-blow-to-sinclair-nexstar-announces-4-1-billion-deal-acquisition-of-tribune/,53,2018-12-03 13:39:29,,False,0.0,0.0,1.0,0.0
GM's restructuring was tough. Ford's could be even harder,politics,11,a350zf,https://edition.cnn.com/2018/12/04/business/ford-job-cut-forecast/index.html,3,2018-12-04 16:21:03,,False,-0.128,0.158,0.842,0.0
"'We Are All Here Together': Demanding Charter Network Use Vast Resources for Better Pay, First of Its Kind Teacher Strike in Chicago",politics,11,a350um,https://www.commondreams.org/news/2018/12/04/we-are-all-here-together-demanding-charter-network-use-vast-resources-better-pay,1,2018-12-04 16:20:40,,False,0.5423,0.171,0.605,0.224
John Dingell calls for Senate to be abolished,politics,32,a31ljm,https://thehill.com/homenews/house/419612-john-dingell-calls-for-senate-to-be-abolished,44,2018-12-04 10:22:41,,False,0.0,0.0,1.0,0.0
Should you need to pass a social media check to get a gun?,politics,20,a3368c,https://www.apnews.com/c04941b69a4a4f29bf34cdb512201e3c,111,2018-12-04 13:08:03,,False,-0.34,0.194,0.806,0.0
How a little lab helps 'clean' coal firms win big subsidies,politics,34,a31oms,https://www.reuters.com/investigates/special-report/usa-coal-labs/,3,2018-12-04 10:32:35,,False,0.7287,0.0,0.567,0.433
Few patients benefit from medical cannabis under Texas law,politics,55,a30f6a,https://www.apnews.com/783e7311757f4b7b811f5c80ae5f731a,6,2018-12-04 07:54:08,,False,0.4588,0.0,0.727,0.273
"You Don’t Understand Tariffs, Man - Trump blinked on trade with China — and it was the right thing to do.",politics,20,a33p0t,https://www.nytimes.com/2018/12/04/opinion/tariffs-trump-china-trade-xi.html,7,2018-12-04 14:04:22,,False,0.0,0.0,1.0,0.0
"Energy Secretary Perry to visit Saudi Arabia, Qatar",politics,12,a359y7,https://www.reuters.com/article/us-usa-energy-perry-mideast/energy-secretary-perry-to-visit-saudi-arabia-qatar-idUSKBN1O328U?il=0,3,2018-12-04 16:46:33,,False,0.2732,0.0,0.769,0.231
GOP lawmaker on Khashoggi killing: 'Journalists disappear' all over the world,politics,11,a359po,https://thehill.com/homenews/house/419711-gop-lawmaker-defends-saudia-arabia-journalists-disappear-all-over-the-world,7,2018-12-04 16:45:52,,False,-0.743,0.412,0.588,0.0
"Who is McCrae Dowless, man who appears to be center of 9th District investigation?",politics,39,a30r5f,https://www.wsoctv.com/news/local/man-in-center-of-voter-fraud-investigation-in-nc-district-9-race-has-criminal-past/882190369,8,2018-12-04 08:39:53,,False,0.0,0.0,1.0,0.0
The North Carolina midterm debacle shows us where the real threat to elections lies,politics,352,a2vwen,https://www.washingtonpost.com/opinions/an-honest-vote-in-north-carolinas-9th-congressional-district-were-not-so-sure/2018/12/03/ff211a9a-f734-11e8-863c-9e2f864d47e7_story.html?utm_term=.fb664aeb889c,5,2018-12-03 21:02:42,,False,-0.7351,0.341,0.659,0.0
Michigan Supreme Court won't have black justice for first time in 33 years,politics,32,a31a0r,https://www.detroitnews.com/story/news/local/michigan/2018/12/04/michigan-supreme-court-black-justice-33-years/2017426002/,7,2018-12-04 09:45:44,,False,0.2081,0.16,0.633,0.207
Will GOP Risk Contempt With Scheme to Enact New Limits on Early Voting?,politics,24,a32j5o,https://onewisconsinnow.org/press/will-republican-legislature-risk-contempt-with-scheme-to-enact-new-limits-on-early-voting/,6,2018-12-04 12:02:51,,False,-0.7096,0.349,0.651,0.0
Trump meeting with Pelosi and Schumer canceled as shutdown looms,politics,2266,a2pv4j,https://www.politico.com/story/2018/12/03/trump-meeting-pelosi-schumer-canceled-1037992,192,2018-12-03 10:52:36,,False,-0.1531,0.151,0.849,0.0
Trump’s Cohen and Stone Twitter tirade could land him in trouble,politics,481,a2uwkm,https://news.vice.com/en_us/article/mby98x/trumps-cohen-and-stone-twitter-tirade-could-land-him-in-trouble?,36,2018-12-03 19:08:17,,False,-0.4019,0.213,0.787,0.0
"Bernie Sanders, Elizabeth Warren send condolences to Bush family",politics,12,a3487p,https://thehill.com/homenews/news/419271-bernie-sanders-elizabeth-warren-send-condolences-to-bush-family,15,2018-12-04 14:59:06,,False,0.0,0.0,1.0,0.0
Removing obstacles to voting needs to be a national priority,politics,1626,a2qu9q,https://thehill.com/opinion/campaign/419345-removing-obstacles-to-voting-needs-to-be-a-national-priority,38,2018-12-03 12:34:03,,False,-0.3818,0.245,0.755,0.0
Beto O'Rourke seen as a top contender in 2020: poll,politics,1684,a2qoml,https://thehill.com/homenews/campaign/419455-beto-orourke-seen-as-top-contender-in-2020-race-for-white-house-poll,698,2018-12-03 12:16:51,,False,0.3182,0.0,0.68,0.32
"Ex-Marine admits he lured Seth Rich conspiracy theorist Jack Burkman to a hotel parking garage, then shot him",politics,259,a2wnp7,https://www.washingtonpost.com/local/public-safety/disgruntled-ex-employee-of-conspiracy-theorist-admits-shooting-him/2018/12/03/e5df4478-f719-11e8-8c9a-860ce2a8148f_story.html,81,2018-12-03 22:29:27,,False,0.34,0.147,0.603,0.25
'Get Me Outta Here': The G20 Stage Gaffe And Trump's Most Undignified Exits,politics,3960,a2odsi,https://www.esquire.com/uk/latest-news/a25376157/get-me-outta-here-the-g20-stage-gaffe-and-trumps-most-undignified-exits/,326,2018-12-03 07:54:27,,False,0.0,0.0,1.0,0.0
Key Republican senator pushing McConnell for vote on criminal justice bill,politics,16,a34403,https://www.cnn.com/2018/12/04/politics/criminal-justice-sentencing-bill-senate/index.html,5,2018-12-04 14:46:48,,False,0.0,0.215,0.57,0.215
Steve Bannon and a Fugitive Billionaire Target a Common Enemy: China,politics,11,a34ne6,https://www.nytimes.com/2018/12/04/business/stephen-bannon-guo-wengui-china.html?action=click&module=Top%20Stories&pgtype=Homepage,2,2018-12-04 15:42:18,,False,-0.5423,0.304,0.696,0.0
House GOP campaign arm “hacked” during 2018 midterm elections,politics,17,a33k32,https://www.nbcnews.com/politics/congress/house-gop-campaign-arm-hacked-during-2018-midterm-cycle-n943601,5,2018-12-04 13:50:29,,False,0.0,0.0,1.0,0.0
This one graphic shows how much more diverse the House of Representatives will become in January,politics,13,a34mfg,https://www.businessinsider.com/changes-in-gender-racial-diversity-between-the-115th-and-116th-house-2018-12,6,2018-12-04 15:39:28,,False,0.0,0.0,1.0,0.0
"Incoming attorney general slams GOP plan to curb his powers, says it subverts democracy",politics,2202,a2pry4,https://www.jsonline.com/story/news/politics/elections/2018/12/03/josh-kaul-incoming-attorney-general-slams-gop-plan-curb-his-powers/2189406002/,54,2018-12-03 10:42:46,,False,0.0,0.0,1.0,0.0
Trump Comes Dangerously Close to Witness Tampering,politics,53,a2zxal,https://www.bloomberg.com/opinion/articles/2018-12-03/trump-tweets-look-a-lot-like-witness-tampering?srnd=premium,16,2018-12-04 06:40:09,,False,-0.4588,0.333,0.667,0.0
U.S. Gives Russia a Deadline on Nuclear Treaty,politics,14,a33nxv,https://www.nytimes.com/2018/12/04/world/europe/inf-treaty-united-states-russia.html?partner=rss&emc=rss,2,2018-12-04 14:01:18,,False,0.0,0.0,1.0,0.0
Pompeo says US suspending landmark nuclear deal because of Russian violations,politics,18,a33nmc,https://abcnews.go.com/Politics/pompeo-us-suspending-landmark-nuclear-deal-russian-violations/story?id=59602417&cid=social_twitter_abcn,5,2018-12-04 14:00:29,,False,-0.4767,0.248,0.657,0.095
Grassley: Criminal justice reform should take priority over judges,politics,20,a32n4g,https://thehill.com/homenews/senate/419645-grassley-criminal-justice-reform-should-take-priority-over-judges,5,2018-12-04 12:14:06,,False,0.0,0.246,0.507,0.246
"Recent developments in Mueller investigation has President Trump speaking in mafia movie tropes ""This sounds like something the criminals I used to prosecute would say.""",politics,888,a2sjpu,https://thinkprogress.org/donald-trump-crimelord-robert-mueller-russia-investigation-special-counsel-2016-election-b8a8a2e50b35/,49,2018-12-03 15:21:39,,False,-0.5994,0.214,0.702,0.084
Mueller Preparing Endgame For Russia Investigation,politics,27,a31egh,https://www.huffingtonpost.com/entry/mueller-preparing-endgame-for-russia-investigation_us_5c06871de4b07aec5752ae04,15,2018-12-04 10:00:39,,False,0.0,0.0,1.0,0.0
Medicare for All Is Even Better Than You Thought,politics,528,a2uaxx,https://jacobinmag.com/2018/12/medicare-for-all-study-peri-sanders/,56,2018-12-03 18:05:26,,False,0.4404,0.0,0.734,0.266
He's a US citizen born in Philadelphia. He says ICE detained him anyway,politics,800,a2su9s,https://www.cnn.com/2018/12/03/us/us-citizen-detained-ice/,44,2018-12-03 15:50:39,,False,-0.4019,0.197,0.803,0.0
"Nielsen Keeps Job After Sucking Up To Trump On Caravan, Tough Facebook Posts",politics,34,a31gp9,https://talkingpointsmemo.com/news/nielsen-on-safe-ground,7,2018-12-04 10:07:30,,False,-0.128,0.111,0.889,0.0
Subpoenas Coming Soon In Trump Emoluments Lawsuit,politics,430,a2uxh8,https://www.npr.org/2018/12/03/673056131/subpoenas-coming-soon-in-trump-emoluments-lawsuit,16,2018-12-03 19:10:43,,False,-0.2263,0.241,0.759,0.0
What The Heck Is Happening In That North Carolina House Race?,politics,361,a2vdp0,https://fivethirtyeight.com/features/what-the-heck-is-happening-in-that-north-carolina-house-race/,24,2018-12-03 20:02:47,,False,0.0,0.0,1.0,0.0
Did Giuliani Admit Trump's Witness Tampering?,politics,161,a2xntq,https://lawandcrime.com/high-profile/legal-experts-pummel-rudy-giuilianis-defense-of-trumps-controversial-roger-stone-tweet/,23,2018-12-04 00:29:54,,False,0.2023,0.0,0.735,0.265
Rudy Giuliani's Twitter typo links to anti-Trump webpage,politics,755,a2syib,https://www.washingtonexaminer.com/news/rudy-giulianis-twitter-typo-links-to-anti-trump-webpage,38,2018-12-03 16:01:34,,False,0.0,0.0,1.0,0.0
2018 may be as good as it gets for the stock market,politics,9,a350m5,https://edition.cnn.com/2018/12/03/investing/stocks-2019-outlook-caution/index.html,8,2018-12-04 16:20:05,,False,0.4404,0.0,0.791,0.209
White House hails China trade truce as skeptics raise doubts,politics,15,a338cx,https://apnews.com/90948085616f4f029e50ecf904b670a1,3,2018-12-04 13:17:39,,False,-0.3818,0.31,0.69,0.0
"Jeffrey Epstein, the convicted sex offender who is friends with Donald Trump and Bill Clinton, explained: How a money manager to the super-wealthy used his “collection” of famous friends to avoid a prison sentence for molesting young girls.",politics,925,a2s6fo,https://www.vox.com/2018/12/3/18116351/jeffrey-epstein-trump-clinton-crimes-molestation,71,2018-12-03 14:44:42,,False,-0.6486,0.244,0.6,0.155
Conway's Husband Suggests Trump is Tampering With Witnesses,politics,1595,a2qdn8,https://thehill.com/blogs/blog-briefing-room/419454-conways-husband-suggests-trump-is-tampering-with-witnesses,46,2018-12-03 11:45:36,,False,0.0,0.0,1.0,0.0
Pompeo: US Will Abandon Nuclear Pact In 60 Days If Russia Won’t Comply With Treaty,politics,11,a34kzo,https://talkingpointsmemo.com/news/pompeo-us-will-suspend-nuclear-pact-in-60-days-due-to-russias-violations,6,2018-12-04 15:35:21,,False,-0.4404,0.172,0.828,0.0
There’s another 29-year-old going to Congress: She also kicked Donald Trump’s butt,politics,2735,a2ot57,https://www.salon.com/2018/12/03/theres-another-29-year-old-going-to-congress-she-also-kicked-donald-trumps-butt/,74,2018-12-03 08:51:16,,False,0.0,0.0,1.0,0.0
Subpoenas to begin for Trump records in emoluments case,politics,615,a2tivx,https://wgem.com/2018/12/03/subpoenas-to-begin-for-trump-records-in-emoluments-case/,15,2018-12-03 16:53:53,,False,0.0,0.0,1.0,0.0
George P. Bush: Attacks on father from Trump stung,politics,22,a32fih,https://thehill.com/homenews/media/419643-george-p-bush-attacks-on-father-from-trump-stung,13,2018-12-04 11:52:35,,False,-0.4404,0.266,0.734,0.0
Trump’s Shallow Sympathies,politics,36,a30nga,https://www.theatlantic.com/politics/archive/2018/12/dont-forget-the-flowers-sunday/577201/,5,2018-12-04 08:26:17,,False,0.0,0.0,1.0,0.0
"James Mattis says U.S. ‘simply cannot trust’ Vladimir Putin, Russia",politics,1307,a2qswc,https://www.washingtontimes.com/news/2018/dec/2/james-mattis-says-us-simply-cannot-trust-vladimir-/,61,2018-12-03 12:29:21,,False,0.0,0.0,1.0,0.0
Columbus Council President Wants To Decriminalize Marijuana,politics,18,a32jrb,http://radio.wosu.org/post/columbus-council-president-wants-decriminalize-marijuana#stream/0,2,2018-12-04 12:04:26,,False,0.0,0.0,1.0,0.0
Subpoenas to begin in Maryland's case against President Trump's business dealings,politics,274,a2vt3s,https://www.baltimoresun.com/news/maryland/politics/bs-md-emoluments-trump-maryland-20181203-story.html,6,2018-12-03 20:52:06,,False,0.0,0.0,1.0,0.0
Biden says he'll decide on presidential run within 2 months,politics,18,a32we9,https://apnews.com/9a3a26b51323485d95330830f1a50880,87,2018-12-04 12:40:28,,False,0.0,0.0,1.0,0.0
Sheriff Punishes SWAT Officer Who Wore QAnon Patch in Pence Photo,politics,129,a2xrzo,https://www.thedailybeast.com/sheriff-punishes-swat-officer-who-wore-qanon-patch-in-pence-photo,41,2018-12-04 00:43:51,,False,-0.4767,0.237,0.763,0.0
Trump praises former adviser who refuses to testify against him. Is this witness tampering?,politics,74,a2z28y,https://www.pbs.org/newshour/politics/trump-praises-former-adviser-who-refuses-to-testify-against-him-is-this-witness-tampering,9,2018-12-04 04:08:55,,False,0.5267,0.0,0.793,0.207
"The Labor Secretary Went Light on a Pedophile; He Must Be Fired, Right Now",politics,4834,a2ngpc,https://www.thedailybeast.com/the-labor-secretary-went-light-on-a-pedophile-he-must-be-fired-right-now?via=mobile&source=Reddit,191,2018-12-03 05:26:35,,False,-0.5574,0.231,0.769,0.0
Georgia voters choosing _ again _ who will oversee elections,politics,18,a32c2k,https://apnews.com/6f0a06492a2e4be1974d75926adbe745,1,2018-12-04 11:42:35,,False,0.0,0.0,1.0,0.0
"In the Trump era, sore losers are becoming the standard, while Bush-style grace is ever more rare",politics,30,a311es,https://www.latimes.com/local/abcarian/la-me-abcarian-bad-sport-politics-20181204-story.html,17,2018-12-04 09:16:24,,False,-0.4767,0.26,0.617,0.123
China reportedly confused by Trump administration's words of triumph after trade truce,politics,9,a35c5d,https://www.cnbc.com/2018/12/04/china-confused-by-trumps-words-of-triumph-after-trade-truce.html,2,2018-12-04 16:52:30,,False,0.2023,0.149,0.649,0.201
The Mueller investigation is closing in on Trump,politics,1696,a2pnm0,https://www.theguardian.com/commentisfree/2018/dec/03/trump-mueller-investigation-manafort-cohen,100,2018-12-03 10:29:35,,False,0.0,0.0,1.0,0.0
Giuliani's Twitter typo used to abuse President Trump,politics,30,a30ihk,https://www.bbc.com/news/technology-46440529,6,2018-12-04 08:07:01,,False,-0.6369,0.375,0.625,0.0
GOP legislatures seek to cement Republican power,politics,21,a325xi,https://thehill.com/homenews/state-watch/419522-gop-legislatures-seek-to-cement-republican-power,4,2018-12-04 11:24:44,,False,0.0,0.0,1.0,0.0
"U.S. Stocks Battered by Trade, Yield Concerns: Markets Wrap",politics,6,a357ee,https://www.bloomberg.com/news/articles/2018-12-03/asian-stocks-set-for-muted-open-curve-flattens-markets-wrap,2,2018-12-04 16:39:17,,False,0.0,0.0,1.0,0.0
Bernie and Ocasio-Cortez's Green New Deal faces a wall of Republican climate change deniers,politics,2014,a2p1hx,https://news.vice.com/en_us/article/4394nm/bernie-and-ocasio-cortezs-green-new-deal-faces-a-wall-of-republican-climate-change-deniers,102,2018-12-03 09:19:31,,False,-0.2732,0.149,0.851,0.0
Rep. Cicilline: Dems to have '30 or 40 great candidates' for 2020,politics,15,a32hh5,http://www.msnbc.com/node/1171486,38,2018-12-04 11:58:26,,False,0.6249,0.0,0.728,0.272
Kudlow Backtracks on Trump Tweet Announcing Car Deal With China,politics,20,a31v8h,https://www.bloomberg.com/news/articles/2018-12-04/kudlow-walks-back-trump-tweet-announcing-car-deal-with-china?srnd=premium,2,2018-12-04 10:53:16,,False,0.0,0.0,1.0,0.0
Paul Manafort reportedly tried to negotiate with Ecuador to secure WikiLeaks founder Julian Assange's return to U.S.,politics,174,a2wpsv,https://www.nydailynews.com/news/politics/ny-news-paul-manafort-ecuador-julian-assange-20181203-story.html,13,2018-12-03 22:36:26,,False,0.34,0.0,0.87,0.13
Kudlow: 'I have no assurances' US and China will reach broader trade deal,politics,24,a31ihg,https://www.washingtonexaminer.com/business/kudlow-i-have-no-assurances-us-and-china-will-reach-broader-trade-deal,3,2018-12-04 10:12:52,,False,0.0772,0.14,0.637,0.223
Incriminating MBS text messages revealed as Pompeo claims no direct link between prince and Khashoggi,politics,471,a2tk9w,https://www.haaretz.com/middle-east-news/mbs-texts-revealed-as-pompeo-claims-no-direct-link-between-prince-and-khashoggi-1.6703738,18,2018-12-03 16:57:32,,False,-0.296,0.136,0.864,0.0
Fact Check: Could the NC election investigation affect the Mark Harris win?,politics,10,a34jcp,https://www.newsobserver.com/latest-news/article222579810.html,7,2018-12-04 15:30:38,,False,0.5859,0.0,0.743,0.257
Republicans’ hard-line stance on immigration may alienate millennials for years,politics,2568,a2obye,https://www.washingtonpost.com/news/monkey-cage/wp/2018/12/03/the-republicans-hard-line-stance-on-immigration-may-alienate-millennials-for-years/,281,2018-12-03 07:46:43,,False,0.0,0.0,1.0,0.0
Oklahoma GOP county chair writes letter to ‘abolish public education',politics,777,a2rt7g,https://thinkprogress.org/oklahoma-gop-county-chair-writes-letter-to-abolish-public-education-7d319c8b1e9c/,88,2018-12-03 14:08:05,,False,0.0,0.0,1.0,0.0
"Top Jewish Democrat: Netanyahu, Dermer wrong to defend Trump on antisemitism",politics,34,a30m0f,https://www.jpost.com/Israel-News/Ron-Klein-PM-Dermer-wrong-to-defend-Trump-on-antisemitism-573450,7,2018-12-04 08:20:49,,False,-0.3182,0.223,0.647,0.129
FBI raids home of Atlantic City mayor,politics,401,a2u16i,https://www.nj.com/atlantic/2018/12/fbi-raids-home-of-atlantic-city-mayor.html,83,2018-12-03 17:40:20,,False,0.0,0.0,1.0,0.0
"Kudlow: US to end subsidies for electric cars, renewables",politics,514,a2szkr,https://thehill.com/homenews/administration/419507-us-to-end-subsidies-for-electric-cars-renewables-white-house,87,2018-12-03 16:04:17,,False,0.0,0.0,1.0,0.0
"George H.W. Bush, Icon of the WASP Establishment—and of Brutal US Repression in the Third World",politics,12,a3296x,https://www.thenation.com/article/george-h-w-bush-icon-of-the-wasp-establishment-and-of-brutal-us-repression-in-the-third-world/,17,2018-12-04 11:34:11,,False,-0.7717,0.324,0.676,0.0
No One Knows What's Happening in This Tent City for Migrant Kids,politics,1178,a2q4hr,https://truthout.org/articles/no-one-knows-whats-happening-in-this-tent-city-for-migrant-kids/,56,2018-12-03 11:19:31,,False,-0.296,0.167,0.833,0.0
"Trump says Michael Cohen should serve ""full and complete sentence""",politics,1285,a2pt9b,https://www.axios.com/trump-twitter-michael-cohen-mueller-investigation-36668a43-5ebf-437c-8095-df36e08ea661.html,233,2018-12-03 10:46:41,,False,0.0772,0.0,0.874,0.126
"Trump may be guilty of witness tampering after Roger Stone tweet, legal experts say",politics,594,a2scot,https://www.businessinsider.com/trump-may-be-guilty-of-witness-tampering-after-roger-stone-tweet-2018-12,21,2018-12-03 15:02:02,,False,-0.3182,0.172,0.736,0.092
"Donald Trump slams massive military spending he once celebrated, bemoans ""uncontrollable arms race""",politics,724,a2rlo4,https://www.newsweek.com/donald-trump-military-spending-arms-race-1241608,75,2018-12-03 13:47:26,,False,0.296,0.145,0.64,0.215
Manafort could be affected by double jeopardy case before Supreme Court,politics,31,a2zzi8,https://www.nbcnews.com/politics/supreme-court/manafort-could-be-affected-double-jeopardy-case-supreme-court-n943176,18,2018-12-04 06:50:12,,False,-0.0258,0.288,0.491,0.221
Here’s how Trump’s proposed Moscow project is even dirtier than it looks,politics,658,a2rrfi,https://www.salon.com/2018/12/03/heres-how-trumps-proposed-moscow-project-is-even-dirtier-than-it-looks/,41,2018-12-03 14:03:16,,False,-0.34,0.179,0.821,0.0
The Russian Connection fully exposed,politics,293,a2unih,https://thehill.com/opinion/white-house/419546-the-russian-connection-fully-exposed,28,2018-12-03 18:40:47,,False,-0.1513,0.285,0.715,0.0
Mueller may be poised to lift the lid of his probe,politics,72,a2ydvs,https://www.cnn.com/2018/12/04/politics/robert-mueller-donald-trump-michael-flynn-paul-manafort-russia-investigation/index.html,30,2018-12-04 02:12:42,,False,0.25,0.0,0.833,0.167
Florida sheriffs investigating after deputy photographed wearing QAnon patch with Pence,politics,1549,a2p0ee,https://thehill.com/blogs/blog-briefing-room/419411-florida-sheriffs-investigating-after-deputy-photographed-wearing,155,2018-12-03 09:15:40,,False,0.0,0.0,1.0,0.0
Trump's Advisers Struggle to Explain Deal He Says He Cut With Xi,politics,312,a2u8yv,https://www.bloomberg.com/news/articles/2018-12-03/trump-s-advisers-struggle-to-explain-deal-he-says-he-cut-with-xi,20,2018-12-03 18:00:29,,False,-0.5267,0.306,0.694,0.0
Avoiding War Between America and China,politics,14,a3255j,https://www.foreignaffairs.com/articles/china/2018-12-03/avoiding-war-between-america-and-china,10,2018-12-04 11:22:39,,False,-0.743,0.612,0.388,0.0
George HW Bush: What makes a one-term president?,politics,28,a3077g,https://www.bbc.com/news/world-us-canada-20861048,16,2018-12-04 07:22:04,,False,0.0,0.0,1.0,0.0
FCC Commissioner Says Agency's 'Hiding' What It Knows About Net Neutrality 'Fraud',politics,397,a2tgz2,https://motherboard.vice.com/en_us/article/nepd8z/fcc-commissioner-says-agencys-hiding-what-it-knows-about-net-neutrality-fraud,13,2018-12-03 16:49:06,,False,0.0,0.0,1.0,0.0
"Wisconsin Republicans gave GOP governor more power, but that's changing with new Dem governor",politics,249,a2uvfe,https://www.politifact.com/wisconsin/statements/2018/dec/03/wisconsin-republican-legislative-leaders/wisconsin-republicans-gave-gop-governor-more-power/,12,2018-12-03 19:04:30,,False,0.0,0.0,1.0,0.0
Trump: Roger Stone has 'guts' for not testifying against me,politics,970,a2qa4t,https://www.politico.com/story/2018/12/03/trump-roger-stone-has-guts-1038787,96,2018-12-03 11:35:27,,False,0.0,0.0,1.0,0.0
Asylum for the Few,politics,9,a33apv,https://jacobinmag.com/2018/11/we-built-wall-asylum-refugees-immigrants,1,2018-12-04 13:23:52,,False,0.0,0.0,1.0,0.0
'The Civil Rights Movement of Our Time': Climate Action Advocates and Progressive Leaders Join Sanders for Latest Town Hall,politics,16,a31st3,https://www.commondreams.org/news/2018/12/04/civil-rights-movement-our-time-climate-action-advocates-and-progressive-leaders-join,7,2018-12-04 10:45:39,,False,0.296,0.0,0.891,0.109
