title,subreddit,score,id,url,num_comments,created_utc,selftext,over_18,compound,neg,neu,pos
"DC, Maryland attorneys general to subpoena Trump Organization, IRS, other entities in emoluments lawsuit against Trump",politics,63,a34krq,https://wgem.com/2018/12/04/dc-maryland-attorneys-general-to-subpoena-trump-organization-irs-other-entities-in-emoluments-lawsuit-against-trump/,1,2018-12-04 15:34:39,,False,-0.2263,0.112,0.888,0.0
Unusual pattern of signatures emerges as North Carolina probes allegations in House race,politics,893,a2xz74,https://www.cnn.com/2018/12/03/politics/north-carolina-absentee-ballot-investigation-house-race/index.html,31,2018-12-04 01:12:01,,False,0.0,0.0,1.0,0.0
Secretary of State Pompeo says the U.S. is suspending its obligations under nuclear treaty over Russian violations,politics,120,a32uf8,https://abcnews.go.com/International/wireStory/secretary-state-pompeo-us-suspending-obligations-nuclear-treaty-59601345,17,2018-12-04 12:34:46,,False,-0.5267,0.175,0.825,0.0
Democratic women are replacing men in leadership positions,politics,59,a34muj,https://www.axios.com/women-in-democratic-leadership-116th-congress-dcf34228-a42b-4436-bffb-e753b8bd6c88.html,7,2018-12-04 15:40:41,,False,0.0,0.0,1.0,0.0
The Republican Party Is the Single Greatest Threat to the American Republic,politics,30545,a2s89v,https://www.esquire.com/news-politics/politics/a25382659/republican-party-bigotry-plutocracy-ratfucking/,2975,2018-12-03 14:49:40,,False,0.5423,0.176,0.466,0.358
Robert Mueller to file sentencing memo on Trump ex-national security adviser Michael Flynn,politics,52,a356js,https://www.cbsnews.com/news/robert-mueller-to-file-sentencing-memo-on-trump-ex-national-security-adviser-michael-flynn/,43,2018-12-04 16:36:55,,False,0.2023,0.107,0.733,0.16
Biden: ‘I think I am the most qualified person in the country to be president’,politics,267,a30cu5,https://thehill.com/homenews/campaign/419577-biden-i-think-i-am-the-most-qualified-person-in-the-country-to-be-president,475,2018-12-04 07:44:43,,False,0.0,0.0,1.0,0.0
Proud Boys founder finds new home at Glenn Beck’s new media company,politics,2639,a2uy5m,https://thinkprogress.org/proud-boys-gavin-mcinnes-glenn-beck-blaze-media-5a56f970c3a3/,212,2018-12-03 19:12:39,,False,0.4767,0.0,0.78,0.22
House Democrats’ New Elected Leadership Team Is More Progressive and Diverse,politics,77,a340y6,http://www.rollcall.com/news/politics/new-democratic-elected-leadership-team-is-more-progressive-and-diverse,10,2018-12-04 14:38:15,,False,0.0,0.0,1.0,0.0
Think President Trump seems rattled now? There may be more to come,politics,233,a30m97,https://www.nbcnews.com/politics/justice-department/think-president-trump-seems-rattled-now-there-may-be-more-n943056,35,2018-12-04 08:21:43,,False,0.0,0.0,1.0,0.0
Legal Experts Say Trump Just Committed Witness Tampering on Twitter,politics,41825,a2rdue,https://www.motherjones.com/politics/2018/12/roger-stone-trump-tweet-witness-tampering/,3580,2018-12-03 13:25:51,,False,0.3818,0.0,0.69,0.31
"Two state AGs to subpoena Trump Organization, IRS, raising specter President's tax returns may finally be released",politics,68,a34o6u,https://www.nydailynews.com/news/politics/ny-pol-ags-trump-irs-tax-returns-20181204-story.html,2,2018-12-04 15:44:34,,False,0.0,0.0,1.0,0.0
Lame-duck bills advance to WI Senate and Assembly,politics,220,a30om7,https://www.nbc15.com/content/news/Wisconsin-Dems-blast-bill-to-limit-early-voting-501802662.html,6,2018-12-04 08:30:40,,False,0.0,0.0,1.0,0.0
Climate Denialism’s Stupidity Is the Point — And Its Weakness,politics,175,a3174n,https://www.bloomberg.com/opinion/articles/2018-12-03/climate-denialism-s-stupidity-frustrates-action,9,2018-12-04 09:36:10,,False,-0.6908,0.449,0.551,0.0
"Ariel Dorfman: George H.W. Bush Is Alive in His Many Victims Across the Globe, Including Me",politics,134,a323jt,https://www.democracynow.org/2018/12/4/ariel_dorfman_george_hw_bush_is,7,2018-12-04 11:17:58,,False,0.0772,0.122,0.741,0.138
Trump shares tweet claiming rioting protesters in France are chanting ‘We want Trump’,politics,112,a32r09,https://thehill.com/homenews/administration/419650-trump-shares-tweet-claiming-rioting-protesters-in-france-are-chanting,66,2018-12-04 12:25:13,,False,0.1531,0.123,0.649,0.227
What Bribery Experts Say About The Trump Organization’s Plan To Give Putin A Penthouse,politics,64,a34mkr,https://www.huffingtonpost.com/entry/trump-putin-fcpa-moscow-project-cohen_us_5c06b70ee4b066b5cfa6885d,4,2018-12-04 15:39:55,,False,0.0,0.0,1.0,0.0
Mueller to detail ex-NSA Flynn’s cooperation in Russia probe,politics,153,a31jx4,https://apnews.com/3a6c2d53e34e4984929fa9a37fe42a49,32,2018-12-04 10:17:26,,False,0.0,0.0,1.0,0.0
Activists put up 'Khashoggi Way' sign on DC street outside Saudi Embassy,politics,63,a34r27,https://thehill.com/homenews/state-watch/419697-activists-put-up-khashoggi-way-sign-on-dc-street-outside-saudi-embassy,3,2018-12-04 15:53:02,,False,0.0,0.0,1.0,0.0
"White House Seeks to End Subsidies for Electric Cars, Renewables",politics,121,a32dv5,https://www.voanews.com/a/white-house-seeks-to-end-subsidies-for-electric-cars-renewables/4685685.html,23,2018-12-04 11:47:56,,False,0.0,0.0,1.0,0.0
Trump's alienation of younger voters is a generational gamble for GOP,politics,277,a300zk,https://www.cnn.com/2018/12/04/politics/trumps-alienation-of-younger-voters-is-a-generational-gamble-for-gop/index.html,21,2018-12-04 06:56:46,,False,-0.2732,0.189,0.811,0.0
Wisconsin’s Walker defies protesters on lame-duck session,politics,48,a355lb,https://apnews.com/d95d1190247b4bc6a611c053214cf77e,6,2018-12-04 16:34:05,,False,-0.2263,0.241,0.759,0.0
"Special counsel will make Manafort memo public by Friday, spokesman says",politics,1563,a2w2j2,https://thehill.com/homenews/administration/419567-special-counsel-will-make-manafort-memo-public-by-friday-spokesman,65,2018-12-03 21:22:09,,False,0.4019,0.0,0.787,0.213
Rep. Argues For Maintaining Saudi Ties: ‘Journalists Disappear All Over The Country’,politics,57,a34w3j,https://talkingpointsmemo.com/news/rep-argues-for-maintaining-saudi-ties-journalists-disappear-all-over-the-country,16,2018-12-04 16:07:00,,False,-0.5423,0.31,0.69,0.0
"After CIA briefing, senators lay blame on Saudi crown prince",politics,64,a347hf,https://apnews.com/3f506fd8c72349b98e0d989c17b736b8,6,2018-12-04 14:56:53,,False,-0.34,0.211,0.789,0.0
The 4 ways Russian collusion might have occurred,politics,95,a32zfj,http://www.washingtonpost.com/politics/2018/12/04/ways-russian-collusion-might-have-occurred/,10,2018-12-04 12:48:52,,False,0.0,0.0,1.0,0.0
Whitewashing of George H.W. Bush's legacy has already begun,politics,269,a2zxr5,https://www.euronews.com/2018/12/04/george-h-w-bush-wasn-t-trump-willie-horton-aids-ncna943331,35,2018-12-04 06:42:08,,False,0.0,0.0,1.0,0.0
Stacey Abrams says she may run for Senate or governor in coming years,politics,159,a3195u,https://thehill.com/homenews/senate/419593-stacey-abrams-says-she-may-run-for-senate-or-governor-in-coming-years,8,2018-12-04 09:43:01,,False,0.0,0.0,1.0,0.0
Alexandria Ocasio-Cortez says Donald Trump administration has been 'criminal from the start',politics,10615,a2r6z2,https://www.newsweek.com/alexandria-ocasio-cortez-says-donald-trump-administration-has-been-criminal-1241484,755,2018-12-03 13:06:39,,False,-0.5267,0.236,0.764,0.0
Alexandria Ocasio-Cortez is changing the way politicians use social media,politics,181,a30uav,https://thinkprogress.org/alexandria-ocasio-cortez-social-media-house-democrats-twitter-instagram-stories-democratic-socialist-congress-01a76857a3d2/,21,2018-12-04 08:51:45,,False,0.0,0.0,1.0,0.0
An Ecosocialist Path to Limiting Global Temperature Rise to 1.5°C An emergency plan to meet the climate emergency,politics,50,a34mw7,https://www.commondreams.org/views/2018/12/04/ecosocialist-path-limiting-global-temperature-rise-15degc?cd-origin=rss,9,2018-12-04 15:40:51,,False,-0.6369,0.245,0.755,0.0
Trump met with Putin after saying he would not: The president blusters his way through another G-20,politics,259,a2zzas,https://www.salon.com/2018/12/03/trump-met-with-putin-after-saying-he-would-not-the-president-blusters-his-way-through-another-g-20/,9,2018-12-04 06:49:11,,False,0.0,0.0,1.0,0.0
America Didn’t Always Lock Up Immigrants,politics,73,a340td,https://www.nytimes.com/2018/12/01/opinion/sunday/border-detention-tear-gas-migrants.html,14,2018-12-04 14:37:53,,False,0.0,0.0,1.0,0.0
Trump Tries to Throw Gasoline on France’s Fuel Riots,politics,62,a34fbs,https://www.motherjones.com/environment/2018/12/trump-tries-to-throw-gasoline-on-frances-fuel-riots/,6,2018-12-04 15:19:07,,False,-0.5106,0.292,0.708,0.0
Now Eric Trump has thoughts on Kellyanne Conway's marriage,politics,124,a31ubo,https://edition.cnn.com/2018/12/04/politics/eric-trump-george-conway-kellyanne-conway/index.html,29,2018-12-04 10:50:24,,False,0.0,0.0,1.0,0.0
"'Banana republic dictators': Democrats fume over last-minute GOP power-grabs in Wisconsin, Michigan",politics,600,a2y9cr,https://www.nbcnews.com/news/amp/ncna943086,29,2018-12-04 01:53:37,,False,-0.296,0.167,0.833,0.0
CIA Director Briefing Stakeout | Reporters wait to hear from senators following a closed-door briefing with CIA Director Gina Haspel on the details of the murder of journalist Jamal Khashoggi.,politics,100,a32h1d,https://www.c-span.org/video/?455466-1/senators-speak-reporters-cia-directors-briefing-khashoggi-killing,8,2018-12-04 11:57:08,,False,-0.6908,0.148,0.852,0.0
R.I. considers marijuana legalization as New England turns green,politics,110,a31wye,http://www.providencejournal.com/news/20181203/ri-considers-marijuana-legalization-as-new-england-turns-green--poll,9,2018-12-04 10:58:34,,False,0.0,0.0,1.0,0.0
US to suspend nuclear treaty with Russia over violations,politics,87,a32tt3,https://www.kcwy13.com/content/news/US-to-suspend-nuclear-treaty-with-Russia-over-violations-501895411.html,17,2018-12-04 12:33:08,,False,-0.6908,0.449,0.551,0.0
Stock market plunges as Wall Street gives Trump’s China deal another look,politics,47,a352lw,https://www.vox.com/platform/amp/policy-and-politics/2018/12/4/18125988/stock-market-plunge-trump-china-tariffs,10,2018-12-04 16:25:25,,False,0.0,0.0,1.0,0.0
Rightwing taskforce secretly approves anti-environment resolutions,politics,61,a347tq,https://www.theguardian.com/us-news/2018/dec/04/alec-taskforce-vote-approve-anti-environment-measures,4,2018-12-04 14:57:57,,False,0.4019,0.0,0.649,0.351
Sean Hannity Apparently Thinks Trump Can Investigate the DOJ via Military Tribunal. That’s ‘Completely False.’,politics,6855,a2rixy,https://lawandcrime.com/legal-analysis/sean-hannity-apparently-thinks-trump-can-investigate-the-doj-via-military-tribunal-thats-completely-false/,473,2018-12-03 13:40:04,,False,0.0,0.0,1.0,0.0
"‘He Did Not Lead on AIDS’: With Bush, Activists See a Mixed Legacy",politics,80,a332zl,https://www.nytimes.com/2018/12/03/us/george-bush-hiv-aids.html?action=click&module=Top%20Stories&pgtype=Homepage,16,2018-12-04 12:59:06,,False,0.0,0.0,1.0,0.0
"Whoops, Rudy Giuliani: Your tweet indirectly called President Trump a traitor",politics,5699,a2rxug,https://www.marketwatch.com/story/whoops-rudy-giuliani-your-tweet-indirectly-called-president-trump-a-traitor-2018-12-03,285,2018-12-03 14:21:01,,False,0.0,0.0,1.0,0.0
A User’s Guide to Ending the Trump Presidency,politics,52,a34tq8,https://www.lawfareblog.com/users-guide-ending-trump-presidency,7,2018-12-04 16:00:33,,False,0.0,0.0,1.0,0.0
GOP senators say Saudi Prince complicit 'to the highest level possible' in Khashoggi murder,politics,44,a34y7x,https://thehill.com/hilltv/rising/419704-gop-senators-say-saudi-prince-complicit-to-the-highest-level-possible-in,4,2018-12-04 16:12:52,,False,-0.6908,0.266,0.734,0.0
GM’s Plant Closures Confirm the President is a Liar and a Fool,politics,970,a2wvvx,https://www.thenation.com/article/gm-plant-close-ohio-michigan-trump/,59,2018-12-03 22:56:40,,False,-0.7351,0.437,0.563,0.0
Cohen says he kept 'Client 1' apprised of Kremlin contacts,politics,733,a2xnek,http://www.msnbc.com/rachel-maddow/watch/cohen-says-he-kept-client-1-apprised-of-kremlin-contacts-1387892803593,47,2018-12-04 00:28:38,,False,0.0,0.0,1.0,0.0
Palm Beach trial could reveal details of billionaire’s alleged abuse of teen girls,politics,1181,a2waro,https://www.washingtonpost.com/national/palm-beach-trial-could-reveal-details-of-billionaires-alleged-abuse-of-teen-girls/2018/12/03/f42e0c4e-f4d0-11e8-bc79-68604ed88993_story.html,127,2018-12-03 21:48:16,,False,-0.6369,0.259,0.741,0.0
Ohio Republicans Join the Fight Against Inconvenient Democracy,politics,49,a34lxx,https://www.esquire.com/news-politics/politics/a25398101/ohio-republicans-referendum-60-percent-voters/,3,2018-12-04 15:38:03,,False,-0.4215,0.41,0.41,0.18
'Thousands of sensitive emails' hacked from Republican congressional campaign arm,politics,52,a34qvx,https://abc7chicago.com/thousands-of-sensitive-emails-hacked-from-republican-congressional-campaign-arm/4831715/,7,2018-12-04 15:52:32,,False,-0.4019,0.231,0.769,0.0
Mueller preparing end game for Russia investigation,politics,2299,a2ud70,https://news.yahoo.com/mueller-preparing-end-game-russia-investigation-225720798.html,204,2018-12-03 18:11:48,,False,0.0,0.0,1.0,0.0
"‘Suddenly, I Have Purpose Again.’ Former Toys ‘R’ Us Employees Are Spending the Holidays Fighting for Their Severance Pay",politics,55,a344u3,http://time.com/money/longform/suddenly-i-have-purpose-again-former-toys-r-us-employees-are-spending-the-holidays-fighting-for-their-severance-pay,7,2018-12-04 14:49:13,,False,-0.0772,0.181,0.698,0.121
Gov. Rick Scott took low road in removing Broward Elections Supervisor Brenda Snipes | Editorial,politics,115,a31r2q,"https://www.sun-sentinel.com/opinion/editorials/fl-op-editorial-brenda-snipes-20181203-story,amp.html?__twitter_impression=true",7,2018-12-04 10:40:12,,False,-0.2732,0.139,0.861,0.0
"Assembly, Senate Poised To Pass Bills Limiting Evers' Power",politics,56,a33stf,https://www.wpr.org/assembly-senate-poised-pass-bills-limiting-evers-power,9,2018-12-04 14:15:06,,False,0.25,0.0,0.8,0.2
Progressive lawmakers call for climate change revolution at town hall,politics,169,a30kjr,https://www.theguardian.com/environment/2018/dec/04/bernie-sanders-alexandria-ocasio-cortez-climate-change-town-hall-green-new-deal,3,2018-12-04 08:14:47,,False,0.0,0.0,1.0,0.0
Kellyanne Conway’s Husband Accuses Trump of Witness Tampering,politics,12792,a2q6xl,https://lawandcrime.com/high-profile/kellyanne-conways-husband-accuses-trump-of-witness-tampering/,518,2018-12-03 11:26:29,,False,-0.34,0.255,0.745,0.0
House Republican Campaign Committee Tells FBI It Was Hacked,politics,62,a338te,https://www.bloomberg.com/news/articles/2018-12-04/house-republican-campaign-committee-tells-fbi-it-was-hacked?srnd=politics-vp,11,2018-12-04 13:18:47,,False,-0.4019,0.252,0.748,0.0
"Report: Mueller Finishing Probe, To File Memos On Flynn, Cohen, Manafort This Week",politics,128,a31ed5,https://talkingpointsmemo.com/news/mueller-preparing-to-file-memos-on-flynn-cohen-manafort,29,2018-12-04 10:00:20,,False,0.0,0.0,1.0,0.0
Mueller’s End Game Is Starting to Come Into View,politics,57,a33zv8,https://washingtonmonthly.com/2018/12/04/muellers-end-game-is-starting-to-come-into-view/,15,2018-12-04 14:35:28,,False,0.0,0.0,1.0,0.0
Broward Sheriff's Office Demotes #QAnon Cop,politics,3093,a2t3kg,https://www.miaminewtimes.com/news/broward-sheriffs-office-demotes-qanon-cop-matt-patten-10940330,234,2018-12-03 16:14:54,,False,0.0,0.0,1.0,0.0
Markets drop as doubts grow over Trump’s China deal,politics,37,a34zwz,https://www.politico.com/story/2018/12/04/markets-drop-trump-china-deal-1008543,10,2018-12-04 16:17:59,,False,-0.5106,0.381,0.619,0.0
The Effects of the Muslim Ban One Year Later,politics,56,a343ho,https://www.aclu.org/blog/immigrants-rights/effects-muslim-ban-one-year-later,1,2018-12-04 14:45:28,,False,-0.5574,0.31,0.69,0.0
An alarming slowdown in global trade shows Trump's tariff war is having a devastating impact,politics,248,a2zpz4,https://www.businessinsider.com/trump-china-trade-war-kuehne-nagel-data-shows-trade-slowdown-2018-12,27,2018-12-04 06:05:53,,False,-0.8658,0.469,0.531,0.0
'I am a Tariff Man': Trump threatens to restart trade war if China talks fail,politics,84,a32fqn,https://www.cnbc.com/2018/12/04/trump-calls-himself-tariff-man-as-china-talks-restart-after-trade-war-truce.html,32,2018-12-04 11:53:16,,False,-0.875,0.476,0.524,0.0
"Republicans don't want ""limited government""—they want government that voters can't change.",politics,10260,a2q9gv,https://www.gq.com/story/wisconsin-republicans-midterm-doesnt-count,519,2018-12-03 11:33:35,,False,0.0572,0.202,0.661,0.138
"Georgia group can prove illegal voter purge by Kemp, leader says",politics,12497,a2pwq3,https://www.yahoo.com/news/georgia-group-can-prove-illegal-voter-purge-kemp-leader-says-100002969.html,265,2018-12-03 10:57:19,,False,-0.5574,0.265,0.735,0.0
White House confusion over Trump's promised tariff delay shows the slapdash nature of the trade deal with Xi Jinping,politics,49,a343v1,https://www.businessinsider.com/trump-xi-trade-war-deal-white-house-correction-on-kudlow-tariff-delay-2018-12,3,2018-12-04 14:46:25,,False,-0.25,0.196,0.696,0.109
Trump praises Roger Stone for not cooperating with Mueller,politics,11891,a2pzzq,https://www.axios.com/trump-roger-stone-not-cooperating-mueller-investigation-3a0898a2-cbae-498c-a8f4-7dffa3a4fd7d.html,1306,2018-12-03 11:06:22,,False,0.5267,0.0,0.702,0.298
Trump Tries To Block Discovery In Emoluments Case,politics,14438,a2pssk,https://talkingpointsmemo.com/muckraker/trump-tries-to-block-discovery-in-emoluments-case,672,2018-12-03 10:45:24,,False,-0.4404,0.293,0.707,0.0
"Trump’s latest tweets cross clear lines, experts say: Obstruction of justice and witness tampering",politics,1841,a2ul2r,https://www.washingtonpost.com/politics/2018/12/03/trumps-latest-tweets-cross-clear-lines-experts-say-obstruction-justice-witness-tampering/?noredirect=on,36,2018-12-03 18:33:45,,False,0.7184,0.0,0.667,0.333
Ocasio-Cortez calls for lawmakers to pay staffers a living wage,politics,4025,a2s550,https://thehill.com/blogs/blog-briefing-room/news/419472-ocasio-cortez-calls-for-lawmakers-to-pay-staffers-a-living-wage,289,2018-12-03 14:41:06,,False,-0.1027,0.149,0.851,0.0
"Graham ties Saudi crown prince to Khashoggi killing: 'There's not a smoking gun, there's a smoking saw'",politics,46,a348ul,https://www.nbcnews.com/politics/congress/graham-ties-saudi-crown-prince-khashoggi-killing-there-s-not-n943671,5,2018-12-04 15:00:55,,False,-0.521,0.226,0.669,0.105
Graham on Senate Rebuke of Saudi Arabia: ‘Someone’s Got To Do It’,politics,120,a312po,https://www.politico.com/story/2018/12/04/graham-senate-rebuke-saudi-arabia-1041379,18,2018-12-04 09:21:06,,False,0.0,0.0,1.0,0.0
Republican National Congressional Committee says it was hacked during this year’s election cycle,politics,61,a332gt,https://www.washingtonpost.com/news/politics/wp/2018/12/04/republican-national-congressional-committee-says-it-was-hacked-during-this-years-election-cycle/,18,2018-12-04 12:57:31,,False,-0.4019,0.184,0.816,0.0
National Republican Congressional Committee says it was hacked during this year’s election cycle,politics,58,a33fyv,https://www.washingtonpost.com/world/national-security/national-republican-congressional-committee-says-it-was-hacked-during-this-years-election-cycle/2018/12/04/58136c7a-f7e9-11e8-8d64-4e79db33382f_story.html?utm_term=.c6f14e81ed31,10,2018-12-04 13:38:15,,False,-0.4019,0.184,0.816,0.0
Trump has won little from China so far. There isn’t an ‘incredible’ deal yet.,politics,143,a30rc1,https://www.washingtonpost.com/business/2018/12/03/trump-has-won-little-china-so-far-there-isnt-an-incredible-deal-yet/,18,2018-12-04 08:40:34,,False,0.5719,0.0,0.778,0.222
"Donald Trump Is 'Compromised' Just as Michael Flynn Was, Adam Schiff Says After Michael Cohen Russia Revelations",politics,7473,a2qhal,https://www.newsweek.com/donald-trump-compromised-michael-flynn-house-democrat-says-1241420,244,2018-12-03 11:56:27,,False,0.0,0.0,1.0,0.0
"Figliuzzi: If Cohen's Truthful, It's the Definition of Kompromat",politics,73,a32mv5,https://www.yahoo.com/amphtml/entertainment/figliuzzi-cohen-apos-truthful-apos-204931339.html,6,2018-12-04 12:13:21,,False,0.4588,0.0,0.727,0.273
Dow slides 700 points as US stocks veer sharply lower,politics,52,a33nab,https://www.foxbusiness.com/markets/dow-slides-700-points-as-us-stocks-veer-sharply-lower,41,2018-12-04 13:59:36,,False,-0.296,0.196,0.804,0.0
"Stone snubs Senate document request, invoking Fifth Amendment",politics,34,a35acp,https://www.politico.com/story/2018/12/04/roger-stone-fifth-amendment-1044597,10,2018-12-04 16:47:45,,False,-0.4767,0.307,0.693,0.0
Alaska Governor-Elect Dunleavy is purging the Department of Law of it's dedicated public servants,politics,47,a34erw,https://www.ktuu.com/content/news/Some-frustration-as-Dunleavy-asks-all-at-will-state-employees-to-resign-and-reapply-500875301.html,9,2018-12-04 15:17:29,,False,0.4588,0.0,0.812,0.188
"Emergency Protests Planned to Stop Scott Walker and Wisconsin GOP's ""Shocking and Naked Power Grab""",politics,22995,a2pbnt,https://www.commondreams.org/news/2018/12/03/emergency-protests-planned-stop-scott-walker-and-wisconsin-gops-shocking-and-naked,1119,2018-12-03 09:52:31,,False,-0.8126,0.461,0.539,0.0
Woman says GOP consultant paid her to illegally collect absentee ballots in North Carolina congressional race,politics,485,a2xyia,https://theweek.com/speedreads/810738/woman-says-gop-consultant-paid-illegally-collect-absentee-ballots-north-carolina-congressional-race,6,2018-12-04 01:09:16,,False,-0.2732,0.123,0.877,0.0
"Bush made Willie Horton an issue, and for African-Americans, the scars are still fresh",politics,61,a32n95,https://www.seattletimes.com/nation-world/nation-politics/bush-made-willie-horton-an-issue-and-for-african-americans-the-scars-are-still-fresh/,3,2018-12-04 12:14:25,,False,0.3182,0.0,0.85,0.15
"Trump’s International Ratings Remain Low, Especially Among Key Allies",politics,144,a30cn9,http://www.pewglobal.org/2018/10/01/trumps-international-ratings-remain-low-especially-among-key-allies/,24,2018-12-04 07:43:58,,False,-0.2732,0.208,0.792,0.0
"Saudi Crown Prince ‘Really Was the Original El Chapo,’ Says GOP Senator Accusing MBS of Killing Khashoggi",politics,40,a34a6t,https://www.newsweek.com/saudi-prince-el-chapo-senator-mbs-khashoggi-1244048,3,2018-12-04 15:04:40,,False,-0.5859,0.272,0.625,0.103
The GOP's lame-duck power grab,politics,85,a31l05,https://theweek.com/articles/810748/gops-lameduck-power-grab,1,2018-12-04 10:20:55,,False,0.0,0.0,1.0,0.0
Green Nightmare: Coal-Loving Manchin May Get Energy Panel Perch,politics,86,a31n3q,https://www.bloomberg.com/news/articles/2018-12-04/green-nightmare-coal-loving-manchin-may-get-energy-panel-perch,9,2018-12-04 10:27:53,,False,0.2732,0.0,0.792,0.208
End to Manafort plea deal could put Palm Beach Gardens home at risk,politics,76,a324cp,https://www.palmbeachpost.com/news/20181204/end-to-manafort-plea-deal-could-put-palm-beach-gardens-home-at-risk,13,2018-12-04 11:20:20,,False,-0.2732,0.149,0.851,0.0
Fox News Panelist Tells Trump It Is Time to 'Drain Your Own Swamp' After Cohen Guilty Plea,politics,3760,a2rotx,https://www.newsweek.com/fox-news-panelist-tells-trump-it-time-drain-your-own-swamp-1239355,181,2018-12-03 13:56:10,,False,-0.4215,0.149,0.851,0.0
Senators Working To Slip Israel Anti-Boycott Law Through In Lame Duck,politics,61,a32st4,https://theintercept.com/2018/12/04/israel-anti-boycott-act-lame-duck/,6,2018-12-04 12:30:15,,False,-0.4215,0.219,0.781,0.0
You can smoke pot in Michigan but not buy it. What you need to know.,politics,30,a34pxe,https://www.bridgemi.com/public-sector/you-can-smoke-pot-michigan-not-buy-it-what-you-need-know,14,2018-12-04 15:49:38,,False,0.0,0.0,1.0,0.0
"In Twist, Trump Now Bemoaning Military Spending As ‘Crazy’",politics,30753,a2p2iu,https://talkingpointsmemo.com/livewire/in-twist-trump-bemoans-military-spending-as-crazy,3195,2018-12-03 09:22:58,,False,0.0,0.0,1.0,0.0
"Ocasio-Cortez eager to consolidate past attempts at a just transition under a Green New Deal At climate town hall, young leaders pledge to hold politicians accountable.",politics,72,a3277e,https://thinkprogress.org/ocasio-cortez-green-new-deal-30fee25982b4/,26,2018-12-04 11:28:22,,False,0.3612,0.0,0.902,0.098
It Looks Like Trump Will Let McConnell Kill the Criminal-Justice Reform Bill,politics,785,a2wbor,https://nymag.com/intelligencer/2018/12/trump-may-let-mcconnell-kill-criminal-justice-reform.html,49,2018-12-03 21:51:08,,False,-0.4939,0.273,0.581,0.145
Sore losers? Wisconsin GOP seeks to strip powers of elected Dem governor,politics,3439,a2rtec,https://www.nbcnews.com/politics/first-read/sore-losers-wisconsin-gop-seeks-strip-powers-elected-dem-governor-n943046,94,2018-12-03 14:08:41,,False,-0.7096,0.371,0.629,0.0
"Chicago teachers go on first-ever charter school strike, demanding more pay, educational resources",politics,56,a32o8a,https://thinkprogress.org/chicago-teachers-go-on-first-ever-charter-school-strike-demanding-more-pay-educational-resources-ad5a796e21e9/,10,2018-12-04 12:17:11,,False,-0.4754,0.337,0.663,0.0
Pompeo Questions the Value of International Groups Like U.N. and E.U.,politics,71,a327tg,https://www.nytimes.com/2018/12/04/world/europe/pompeo-brussels-speech.html,24,2018-12-04 11:30:14,,False,0.5994,0.0,0.647,0.353
House Republican campaign arm hacked during 2018 midterms,politics,48,a339si,https://www.cnn.com/2018/12/04/politics/nrcc-hack-midterms/index.html?adkey=bn,16,2018-12-04 13:21:15,,False,-0.4019,0.278,0.722,0.0
Emails of Senior NRCC Aides Hacked by Suspected Foreign Entity,politics,31,a34p2q,https://www.usnews.com/news/politics/articles/2018-12-04/emails-of-senior-nrcc-aides-hacked-by-suspected-foreign-entity,2,2018-12-04 15:47:05,,False,-0.5574,0.365,0.635,0.0
