title,subreddit,score,id,url,num_comments,created_utc,selftext,over_18,compound,neg,neu,pos
Congratulations to the /r/movies Fantasy Movie League fall 2018 winners! The new season starts Friday morning; come join the fun!,movies,55,a3fpac,https://www.reddit.com/r/movies/comments/a3fpac/congratulations_to_the_rmovies_fantasy_movie/,10,2018-12-05 14:35:59,"**The new season starts this week!**

Now is the perfect time to join. The top 10 winners of the Awards season will be awarded special flair here on /r/movies. Have questions? Feel free to ask!

**How to join:** Create a free account on FantasyMovieLeague.com and **[join the /r/movies league](http://fantasymovieleague.com/league/3185/join?mp=5e8a5709f662f8d401f7a00e6137f9ca)**. Clicking that link should allow you to automagically join, but just in case, the password is *reddit*. It's totally free, easy to play, and takes only a couple of minutes to update. The deadline to set your first lineup is this Friday at 12PM EST.

**How to play**: Each week you have eight screens to fill with currently playing movies in your fake theater. You can play the same movie multiple times or leave screens blank. You have $1000 to spend on movies and they are priced according to what they are projected to make. Playing the movie that  gets you the best box office per price will grant you a $2 million bonus every time you play it that week. Leaving screens blank costs you $2 million in penalties. There's also a $5 million bonus for having the perfect cinema. Your scores are added to your previous week's, and at the end of the 12-week season the highest total wins! 

Best of luck in the new season!

---

**CONGRATS TO OUR FALL TOP 10**

Place | Cineplex Name | Total Box Office Earned
---|---|----
1st | Chief Brody | $1,063,993,070
2nd | Still Showing Blade Runner 2049 | $1,061,426,243
3rd | The Man, The Myth, The Dorito | $1,052,120,585
4th | Devil | $1,051,462,651
5th | Nux | $1,047,411,769
6th | 31616 | $1,045,900,063
7th | not bobby | $1,045,624,280
8th | Anepicmoviereviewer Cineplex | $1,043,721,964
9th | Undecided Voter | $1,043,658,862
10th | Daniel's Cineplex | $1,038,276,082

These top 10 leaders can claim their special flair by replying to the post in the /r/movies league (on FML) with their reddit username. Also: By popular request, the [**FML Discord**](https://discord.gg/3mruSUy) is a great place to interact with other players!",False,0.9199,0.0,0.55,0.45
First Image of Ian McKellen in William Shakespeare Drama 'All Is True' - Also Starring Kenneth Branagh & Judi Dench,movies,21152,a3n6rl,https://i.redd.it/mo6f786g8n221.jpg,616,2018-12-06 06:33:16,,False,0.4215,0.0,0.859,0.141
First poster for ‘Shazam’,movies,602,a3px28,https://i.redd.it/43fh43g3xo221.jpg,149,2018-12-06 12:12:08,,False,0.0,0.0,1.0,0.0
Jake Gyllenhaal officially confirms Mysterio role in Spider-Man: Far From Home,movies,47911,a3hkzi,https://www.flickeringmyth.com/2018/12/jake-gyllenhaal-confirms-mysterio-role-in-spider-man-far-from-home/,1920,2018-12-05 17:48:36,,False,0.0,0.0,1.0,0.0
"Ryan Reynolds to Produce Horror Film ‘The Patient Who Nearly Drove Me Out of Medicine’, Based on a Story in /r/NoSleep",movies,4776,a3iupv,https://variety.com/2018/film/news/ryan-reynolds-the-patient-who-nearly-drove-me-out-of-medicine-1203081987/,316,2018-12-05 20:06:22,,False,-0.5719,0.163,0.837,0.0
2019 Golden Globe Nominations: Complete List,movies,326,a3nr1n,https://variety.com/2018/film/news/golden-globe-nominations-2019-1203082075/,825,2018-12-06 08:09:53,,False,0.0,0.0,1.0,0.0
Christian Bale Says He's Almost Done With Physical Transformations after watching Gary oldman in Churchill,movies,211,a3oa4n,https://youtu.be/v8oH_tAOLrE?t=144,62,2018-12-06 09:16:49,,False,0.0,0.0,1.0,0.0
Black Swan is streaming on Pluto TV for free this month,movies,297,a3p9zn,http://watchpluto.com/black_swan,14,2018-12-06 11:08:42,,False,0.5106,0.0,0.752,0.248
Top 10 most tweeted movies of 2018,movies,77,a3p7v2,https://i.redd.it/3b2os7yoko221.jpg,37,2018-12-06 11:02:40,,False,0.2023,0.0,0.769,0.231
Aquaman IMAX artwork,movies,71,a3phhx,https://i.redd.it/0i957qxhpo221.jpg,12,2018-12-06 11:29:47,,False,0.0,0.0,1.0,0.0
"""Movies in 2018 - Mashup Movie Trailer"". This is the third annual year end supercut I've put together and I'm really excited about it!",movies,133,a3qcyd,https://www.youtube.com/watch?v=xppA3zWaCC8,6,2018-12-06 12:56:25,,False,0.4561,0.0,0.881,0.119
Hercules : Zero to Hero | Disney Side by Side by Oh My Disney,movies,63,a3ohgn,https://www.youtube.com/watch?v=sCoJvu8PF7Q,11,2018-12-06 09:41:59,,False,0.5574,0.0,0.753,0.247
"Patrick Bateman, The Terminator, Tony Montana, John Wick and more, ""Hell's Club"" is easily the most inventive movie mashup I've ever seen.",movies,26972,a3c3a2,https://www.youtube.com/watch?v=QajyNRnyPMs,615,2018-12-05 08:02:14,,False,0.34,0.0,0.897,0.103
Savage Questions | Once Upon A Deadpool,movies,41,a3pam8,https://www.youtube.com/watch?v=rEQCvUwS2hY&ebc=ANyPxKolmID8jrEacd4Lll9-bw6-v9IXuFBtf5lFjVmf9Gj3Jx1_db00Pp9CcYbUK3fkD8nO8EB9__7HmLdqW7HI-ig9tdkFLw,10,2018-12-06 11:10:27,,False,-0.4588,0.429,0.571,0.0
"Women of Action: Meet the Stunt Performers Who Help Scarlett Johansson, Evangeline Lilly, Elizabeth Olsen and More Stars Kick Ass",movies,50,a3orqs,https://www.hollywoodreporter.com/features/meet-stuntwomen-who-help-scarlett-johansson-sarah-michelle-gellar-1165239,2,2018-12-06 10:14:46,,False,-0.2648,0.154,0.736,0.11
Aquaman IMAX artwork with proper ratio,movies,27,a3q629,https://i.redd.it/cb27uxnl1p221.jpg,3,2018-12-06 12:37:22,,False,0.0,0.0,1.0,0.0
Punisher: War Zone Director Lexi Alexander On The Curious Journey To Cult Status,movies,26,a3ph6s,https://www.gizmodo.com.au/2018/12/punisher-war-zone-director-lexi-alexander-on-the-curious-journey-to-cult-status/?fbclid=IwAR1Qk_Ch15DkVAPJ8z6dLLBNJ72z7rMpFGR-IVTrEb9zEUchl-VK4IKmPoA,18,2018-12-06 11:29:00,,False,-0.6705,0.356,0.524,0.12
Rogue One/Zero Dark Thirty Cinematographer Heads to Dune,movies,653,a3gcph,https://www.slashfilm.com/bond-25-cinematographer/,109,2018-12-05 15:41:48,,False,0.0,0.0,1.0,0.0
The ‘Men in Black’ Reboot Is Titled ‘Men in Black International’,movies,970,a3f3ib,http://collider.com/men-in-black-reboot-title,235,2018-12-05 13:33:55,,False,0.0,0.0,1.0,0.0
How QUEEN Ruined BOHEMIAN RHAPSODY (Review),movies,14,a3pppy,https://www.youtube.com/watch?v=D-VYQU-GjKc,13,2018-12-06 11:51:54,,False,-0.4767,0.383,0.617,0.0
BlacKkKlansman nominated for 4 Golden Globes!,movies,11,a3q9a4,https://i.redd.it/2ur495e63p221.jpg,13,2018-12-06 12:46:13,,False,0.0,0.0,1.0,0.0
"New Poster for Netflix's 'Mowgli' - Starring Christian Bale, Cate Blanchett, Naomie Harris, Benedict Cumberbatch, Matthew Rhys, and Freida Pinto - Directed by Andy Serkis",movies,2861,a3bjdf,https://i.redd.it/gc8zv5e45g221.jpg,370,2018-12-05 06:41:24,,False,0.0,0.0,1.0,0.0
"Golden Globes 2019: Sandra Oh, Andy Samberg to co-host",movies,311,a3h60m,https://www.usatoday.com/story/life/tv/2018/12/05/golden-globes-2019-sandra-oh-andy-samberg-co-host/2219188002/,62,2018-12-05 17:05:26,,False,0.0,0.0,1.0,0.0
A24 Acquires Horror-Thriller ‘The Hole in The Ground’,movies,7,a3qev0,https://variety.com/2018/film/news/a24-directv-acquire-sundance-horror-thriller-the-hole-in-the-ground-exclusive-1203080039/,3,2018-12-06 13:01:18,,False,0.0,0.0,1.0,0.0
Quickest you turned off a movie?,movies,831,a3dz0g,https://www.reddit.com/r/movies/comments/a3dz0g/quickest_you_turned_off_a_movie/,1250,2018-12-05 11:41:21,"15:17 to Paris about the Americans who stopped a terrorist attack on a French train. 

Narrator and lead character who is black: ""you're probably wondering what a brother is doing hanging out with these two crackers?"" uhhh no?

Narrator: ""My one friend always has my back if there's trouble, same with my other friend cuz he's probably the one who found it."" ...

Narrator: ""now let me take you back to where it alll began."" surprised there's no record scratch. 

*Flashback to middle school* okay fuck I don't need this much backstory!

Deleted from my PVR within 60 seconds of the movie starting.",False,0.0,0.0,1.0,0.0
"Filming Aguirre, the Wrath of God and Nosferatu",movies,9,a3pgfs,https://www.youtube.com/watch?v=ke0kevfTNa0&lc=z22rjpyicmfbffyip04t1aokgwjktn14jfzyeun1oj2brk0h00410,0,2018-12-06 11:27:02,,False,0.2732,0.0,0.769,0.231
Rambo 5: Sly Shares Details Of Final Film & Says Rambo Is On A 'Real Dark Journey',movies,61,a3lha9,https://pursuenews.com/rambo-5-sly-shares-details-of-final-film-says-rambo-is-on-a-real-dark-journey/,40,2018-12-06 01:43:38,,False,0.296,0.0,0.864,0.136
Ladybird was sweet and heartfelt,movies,20,a3neo4,https://www.reddit.com/r/movies/comments/a3neo4/ladybird_was_sweet_and_heartfelt/,13,2018-12-06 07:09:26,It is one of the best coming of age movies i've ever seen. Sensational directional debut from greta gerwig. Saoirse ronan is a talented young actress who is making a name for herself. She has already been nominated for an oscar and she will win one eventually. The movie made me quite emotional. I despised timothee chalamet's character. Such a douche. Any other movies like it?,False,0.7579,0.0,0.316,0.684
Before Sunrise: The Back Story,movies,8,a3psho,https://www.reddit.com/r/movies/comments/a3psho/before_sunrise_the_back_story/,1,2018-12-06 11:59:34," 

[https://humblerealizationz.blogspot.com/…/before-sunrise-ba…](https://humblerealizationz.blogspot.com/2018/12/before-sunrise-back-story.html?fbclid=IwAR3Csty8htTa7xJWYKUBMOi_vKys1LLFUVov1Vr6VD90B4qfG5JxF1Wt8n8)

I'm a big fan of the movie and recently went to Vienna to capture the locations in which the movie was shot. After my trip, I sat down and did a little research on the background story of the movie and what I found out was even more fascinating than the movie itself. In this blogpost, I talked about ""my findings"" and share my opinion about them!

""The script is originally written by Richard Linklater and Kim Krizen based on a real-life story that happened to Linklater"" which is as romantic as the movie itself and equally tragic.

Find more in the blog.",False,0.0,0.0,1.0,0.0
Los Angeles film museum to debut with exhibit showcasing work of Studio Ghibli's Hayao Miyazaki,movies,1736,a3bdnd,https://www.japantimes.co.jp/culture/2018/12/05/entertainment-news/los-angeles-film-museum-debut-exhibit-showcasing-work-studio-ghiblis-hayao-miyazaki/,32,2018-12-05 06:15:13,,False,0.0,0.0,1.0,0.0
"Why ""Wildlife"" is one of my favorite films of this year",movies,9,a3oyr2,https://www.reddit.com/r/movies/comments/a3oyr2/why_wildlife_is_one_of_my_favorite_films_of_this/,3,2018-12-06 10:36:11,"Paul Dano has directed a masterpiece. I can't stop thinking about this movie. Mulligan and Gyllenhaal are fantastic, but Ed Oxenbould is the standout for me. The characters are so well realized that I felt like I knew them personally. But at the same time, Dano and Kazan don't reveal too much of the characters' inner dialogue -- which actually draws you closer to that time period, as emotions and true feelings were commonly suppressed. The film has an excellent sense of location and time. It may have had a bigger impact on me because I've gone through what Joe goes through; I strongly related to him. I urge everyone to check out this film.",False,0.4588,0.0,0.769,0.231
'Bond 25' Adds Cinematographer Linus Sandgren ('La La Land' & 'First Man'),movies,482,a3e115,http://collider.com/bond-25-cinematographer-linus-sandgren/,61,2018-12-05 11:47:14,,False,0.0,0.0,1.0,0.0
"CNN: MoviePass is changing its prices again. Yes, really",movies,4,a3quvr,https://www.cnn.com/2018/12/06/media/moviepass-new-pricing-plan/index.html,1,2018-12-06 13:44:34,,False,0.4019,0.0,0.748,0.252
What would be the most interesting movie remake if the story was told from a different character’s perspective?,movies,53,a3keye,https://www.reddit.com/r/movies/comments/a3keye/what_would_be_the_most_interesting_movie_remake/,115,2018-12-05 23:15:22,"There are many hero vs. villain movies could be awesome if re-told from the opposing viewpoint. For the benefit of discussion let’s not neglect great supporting characters, and even off-screen characters who are affected by the events of the movie, whose point of view on a story could be a more interesting take on things...",False,0.4576,0.0,0.842,0.158
Do movies about serial killers usually cause any controversy from the families of the depicted victims?,movies,5,a3ptj1,https://www.reddit.com/r/movies/comments/a3ptj1/do_movies_about_serial_killers_usually_cause_any/,18,2018-12-06 12:02:31,"Seeing as Joe Berlinger's *Extremely Wicked(...)* premiering in a month, I was wondering if anyone knew if movies about serial killers have a history of causing a commotion with the families of the deceased?

For example, when *Zodiac* (2007) was released, were the relatives of the victims in the film disturbed or upset due to a movie making money off of their suffering?",False,-0.765,0.32,0.68,0.0
Joe Pantoliano To Return For Sony’s ‘Bad Boys for Life’ Sequel,movies,119,a3hk62,https://deadline.com/2018/12/joe-pantoliano-sony-bad-boys-for-life-sequel-1202514784/,42,2018-12-05 17:46:08,,False,0.0,0.0,1.0,0.0
In defense of Arnold Schwarzenegger's 'Jingle All the Way',movies,530,a3ctt4,https://ew.com/movies/2018/12/05/in-defense-of-jingle-all-the-way/,275,2018-12-05 09:37:05,,False,0.128,0.0,0.842,0.158
Not finished yet but I’m sure someone here can guess who this is🙃🙀,movies,3,a3poiv,https://i.redd.it/5fjrybxvso221.jpg,11,2018-12-06 11:48:30,,False,0.4497,0.0,0.803,0.197
The official ‘Mortal Engines’ reviews are in...,movies,163,a3g8b9,https://www.reddit.com/r/boxoffice/comments/a3g58y/other_mortal_engines_reviews_are_in_updated/,187,2018-12-05 15:29:01,,False,0.0,0.0,1.0,0.0
Tom Cruise urges home movie watchers to turn off motion smoothing for a better experience.,movies,31246,a36g35,https://www.theverge.com/2018/12/4/18126306/tom-cruise-psa-motion-smoothing-christopher-mcquarrie,4558,2018-12-04 18:51:03,,False,0.4404,0.0,0.818,0.182
"John D.F. Black, Screenwriter on 'Shaft' and 'Star Trek,' Dies at 85",movies,3,a3q9jv,https://www.hollywoodreporter.com/news/john-df-black-dead-shaft-star-trek-screenwriter-was-85-1167039,0,2018-12-06 12:46:50,,False,0.0,0.0,1.0,0.0
Modern Trailer for TMNT (1990),movies,3,a3q6kl,https://youtu.be/lLkhbGNvf3g,3,2018-12-06 12:38:44,,False,0.0,0.0,1.0,0.0
What are some of the best overlooked movies of 2018?,movies,82,a3hmmn,https://www.reddit.com/r/movies/comments/a3hmmn/what_are_some_of_the_best_overlooked_movies_of/,166,2018-12-05 17:53:26,"This year i had the biggest dry spree of movies i have had in the past 3 years. I just couldnt find any movies i cared about.

But then a couple movies came out in a row i wanted to watch and i watched all of them.

First Reformed, Summer of 84, Under The Silver Lake, Buster Scruggs, and Upgrade, and earlier this year i enjoyed Thoroughbreds, Hereditary, Midnighters, Ghost Stories, Calibre, Ghostland, and Replace.

But other then those i have had a hard time finding really ""wow"" movies. Usually every year i have about 5 movies im just completely blown away by either they just impress the hell out of me, or they are extremely emotional and they stick with me, this year i havnt had many that blew me away...infact i cant really think of any, First Reformed and Hereditary came close...

So what are some of the best overlooked, or just non-blockbuster movies this year? Or just some of the most ""wow"" or emotional movies this year?",False,0.6249,0.083,0.602,0.316
"What movies were considered 'bad' when they first were released, but are considered as 'great' today?",movies,2,a3qvg3,https://www.reddit.com/r/movies/comments/a3qvg3/what_movies_were_considered_bad_when_they_first/,11,2018-12-06 13:46:05,"I just read that Scarface almost ruined Al Pacino's career because at the time when it was released it was seen as something so gruesome, tasteless and over the top, that it was considered a terrible film because there was nothing quite like it at the time. Today it's one of Al Pacino's best performances and the movie is considered a classic.

Are there any other movies that were seen as bad when they first were released, but as time went by, opinion changed and people started thinking these films were good? ",False,0.0,0.0,1.0,0.0
Sean Penn filming Khashoggi documentary in Turkey: reports,movies,253,a3drsh,https://thehill.com/blogs/in-the-know/in-the-know/419835-sean-penn-filming-khashoggi-documentary-in-turkey-reports,84,2018-12-05 11:20:55,,False,0.0,0.0,1.0,0.0
'Black Panther' Stars Surprise Student With Scholarship at Hollywood Reporter's Women in Entertainment Event,movies,1,a3qle3,https://www.hollywoodreporter.com/news/black-panther-stars-surprise-student-scholarship-at-hollywood-reporter-event-1166487,0,2018-12-06 13:18:54,,False,0.5994,0.0,0.71,0.29
Who’s the most hateable movie villain,movies,206,a3e7f6,https://www.reddit.com/r/movies/comments/a3e7f6/whos_the_most_hateable_movie_villain/,427,2018-12-05 12:04:43,"Likeable villains are great, but I think the ones that stick in our mind the most are the ones we despaired. Not because they were bad villains, but because they were good ones. Villains that are so sick and vile that we applaud their demise. 

My pick is John Fitzgerald from the Revenant. Rotten fucking snake. He kills Hugh’s son and leaves him to die, and then straight up lies to Andrew about it. Then he flees like a coward when Hugh comes back, and ends up killing Andrew. His brutal death was well deserved.",False,-0.5945,0.436,0.564,0.0
‘Sicario 2’ Director Stefano Sollima to Direct Michael B. Jordan in ‘Without Remorse’ Adaptation,movies,67,a3hqox,https://variety.com/2018/film/news/sicario-2-without-remorse-michael-b-jordan-1203081476,54,2018-12-05 18:05:31,,False,0.0,0.0,1.0,0.0
"Every year The New York Times selects the year's best movie performances, and the actors celebrate with short films that they star in. This year's crop involves dancing, and they are terrific.",movies,2,a3qhbq,https://www.nytimes.com/interactive/2018/12/05/magazine/great-performers-justin-peck-dance.html,1,2018-12-06 13:07:43,,False,0.9001,0.0,0.725,0.275
'Under The Silver Lake' Staring Andrew Garfield is One of The Years Most Ambitious Films That Went Unnoticed.,movies,36,a3ismp,https://www.reddit.com/r/movies/comments/a3ismp/under_the_silver_lake_staring_andrew_garfield_is/,38,2018-12-05 19:59:59,"This is David Robert Mitchell's follow up to It Follows. Definitely a very divisive. I wasn't sure if I was on board until about half an hour into the film. It is very very Lynch like. If you loved Mulholland Drive you should definitely check this film out. 

I'm not even sure if I liked it, I feel like I'm not sure of much of anything after watching this. I'm just glad that films like this are still being made and that seems to be getting rarer and rarer. 

[Trailer](https://www.youtube.com/watch?v=mwgUesU1pz4)

**Edit - This movie has not been released yet in the USA, please feel free to tell me again though",False,0.5256,0.0,0.834,0.166
'Between Two Ferns with Zach Galifianakis' Movie in the Works at Netflix,movies,22028,a34hc2,https://www.hollywoodreporter.com/news/between-two-ferns-zach-galifianakis-movie-works-1166173,699,2018-12-04 15:24:52,,False,0.0,0.0,1.0,0.0
First Image of Tyler Perry as Secretary of State Colin Powell in Adam McKay's Political-Biopic 'Vice' - Also Starring Christian Bale as Dick Cheney & Sam Rockwell as George W. Bush,movies,4221,a36ci8,https://i.redd.it/t2dfd019kc221.jpg,347,2018-12-04 18:39:44,,False,-0.5106,0.105,0.895,0.0
Don Mancini Talks Openly About His Feelings On MGM's Upcoming Remake of 'Child's Play',movies,79,a3fmgy,https://bloody-disgusting.com/movie/3536544/don-mancini-talks-openly-feelings-mgms-upcoming-remake-childs-play/,65,2018-12-05 14:28:14,,False,0.34,0.0,0.844,0.156
The Standoff at Sparrow Creek - OFFICIAL TRAILER,movies,34,a3igmk,https://www.youtube.com/watch?v=Cu8cfNMu99Y,0,2018-12-05 19:22:16,,False,0.0,0.0,1.0,0.0
How would you do ‘Home Alone’ today?,movies,1,a3qyic,https://www.reddit.com/r/movies/comments/a3qyic/how_would_you_do_home_alone_today/,0,2018-12-06 13:54:25,"If you were tasked to write a modern retelling of the holiday classic, **‘Home Alone’** how would you go about it?

Would it even be possible anymore with cell phones, computers, & all the various ways we’re connected to each other?

Is the story of Home Alone so firmly entrenched in the ‘time period’ it was made, that it would be impossible to do a modernized version of it in 2018-19?",False,0.0,0.0,1.0,0.0
Christmas at Bellagio 2018,movies,0,a3qwfi,https://www.youtube.com/attribution_link?a=lmSMgXvSQbg&u=%2Fwatch%3Fv%3DDmpT-Y_7u0g%26feature%3Dshare,0,2018-12-06 13:48:50,,False,0.0,0.0,1.0,0.0
"Wes Anderson's 'The French Dispatch': Brad Pitt Exits Project, Léa Seydoux Officially Joins Cast",movies,117,a3e7ll,https://theplaylist.net/brad-pitt-lea-seydoux-french-dispatch-20181205/,23,2018-12-05 12:05:10,,False,0.0,0.0,1.0,0.0
Auction: Bid to win Johnny Depp's theater seat from Public Enemies,movies,0,a3quhz,https://www.reddit.com/r/movies/comments/a3quhz/auction_bid_to_win_johnny_depps_theater_seat_from/,0,2018-12-06 13:43:34,"In 2008, the beautiful and historic Paramount Theatre in Aurora, Illinois, doubled as Chicago’s Biograph Theater in the Blockbuster Film *Public Enemies* starring Johnny Depp as John Dillinger. Depp’s Dillinger sees a newsreel about him in the theater and tries to sneak out.

On December 6, 2018, Paramount Theatre will auction the **exact** seat that Johnny Depp sat in while filming *Public Enemies*.

The auction opens at 10 a.m. on Thursday, December 6, 2018, for the  Johnny Depp Seat with official gold plaque. The seat will also be available for viewing that day in Paramount’s Grand Gallery from 10 a.m. to 3 p.m. The auction closes at 3 p.m. CST

[https://paramountaurora.com/support/#johnny-depp-seat-auction](https://paramountaurora.com/support/#johnny-depp-seat-auction)  
 ",False,0.1531,0.2,0.562,0.237
"'The Queen's Corgi' Adds Jack Whitehall as lead, Julie Walters as the Queen, Jon Culshaw as President Trump and Debra Stevenson as Melania Trump.",movies,1,a3olw0,https://www.thewrap.com/the-queens-corgi-adds-jack-whitehall-julie-walters-ray-winstone-to-voice-cast/,6,2018-12-06 09:56:27,,False,0.0,0.0,1.0,0.0
Why don’t Directors tell actors their roles have been cut or downsized in movies before viewing them?,movies,29,a3i2zx,https://www.reddit.com/r/movies/comments/a3i2zx/why_dont_directors_tell_actors_their_roles_have/,25,2018-12-05 18:41:36,"I just read an IndieWire piece reporting on Timothy Chalamet lamenting seeing his role in “Interstellar” being cut down substantially upon initial viewing. He mentioned feeling like a fraud when promoting the movie. 

https://www.indiewire.com/2018/12/timothee-chalamet-interstellar-disappointment-wept-for-an-hour-1202025502/?fbclid=IwAR2jDuKWrRyvmTq2M_0iFN1FvkNIGvoAig0qpfRc-ysdzWyMAnoDNMRY_fg

It brought to mind some famous actors who were upset to only find out upon initial viewing that their roles had been cut or reduced, such as Sean Penn in “Tree of Life,” and Gabriel Byrne in “The Usual Suspects.

For those “in the business,” is it commonplace for directors to notify actors when their roles are cut or reduced before screening? 

Seems to me it would be courteous to let them know beforehand but maybe not. Hoping someone could explain the ins and outs of this process.",False,-0.2732,0.116,0.884,0.0
Richard Kind reveals Bing Bong's final scene in Inside Out was edited down as the original was 'too hard hitting'.. what!?,movies,0,a3ol6h,https://www.reddit.com/r/movies/comments/a3ol6h/richard_kind_reveals_bing_bongs_final_scene_in/,1,2018-12-06 09:54:14,"Xpost r/Movie_Trivia

Richard Kind said in an interview that Bing Bong's dialogue was edited to remove a tone of bitterness from his final sacrifice:

'The version that came out for the public was about 20 to 40 seconds shorter than the scene we recorded, because it got a little too hard-hitting. I asked [the director], ‘Do I have to get laughs with this?’ And they said ‘No, this is a sober moment."" And I told Joy, ‘Don’t you understand? We are forgotten! We don’t count anymore!''

https://www.cinemablend.com/new/Pixar-Changed-One-Inside-Out-Scene-Because-It-Was-Devastatingly-Sad-72344.html

Personally I don't see how the scene could be more hard hitting..I think if Bing Bong has been bitter it would have been *less* upsetting to me.",False,0.68,0.055,0.709,0.236
Evan Spiliotopoulos and Sam Raimi Team On James Herbert Novel ‘Shrine’ at Screen Gems,movies,1,a3qrho,https://deadline.com/2018/12/sam-raimi-james-herbert-shrine-evan-spiliotopoulos-screen-gems-1202511629/,0,2018-12-06 13:35:33,,False,0.3182,0.0,0.85,0.15
IN SEARCH OF THE LAST ACTION HERO - Trailer,movies,0,a3qlml,https://youtu.be/XvYQcz2wmQQ,0,2018-12-06 13:19:34,,False,0.6523,0.0,0.618,0.382
