title,subreddit,score,id,url,num_comments,created_utc,selftext,over_18,compound,neg,neu,pos
The possible twist to the upcoming Glass film.,movies,0,a3l91c,https://www.reddit.com/r/movies/comments/a3l91c/the_possible_twist_to_the_upcoming_glass_film/,5,2018-12-06 01:08:54,"Without making you read a bunch, cuz this theory is lonnnng winded.. and also has an extra meta higher dimensional theory on top of it afterwards.... My theory is that all the super characters as well as others are delusions inside the girls head. The girl from Split, that is. I forget her name.

Now my reasoning. I remember contemplating what the twist could be and this idea occurred to me. I figured it must be the girl who acts as the stage. So I watched the movie a second time looking for possible clues. I got the impression big time for some reason that I was right. I could smell it, but that doesn't really count as evidence.

But then... Evidence happened. The scene where the old lady psychologist visits Mr. Split. She sneaks away to open the door to find one of the teenage hostages... Do you remember? Did you notice it too?

The old lady is standing there clear as day in the open door yet the teenager calls out, hello? Is anyone there? Heellllp! Or something like that.

Huh? Is she blind? Was the writing bad? Why would she ask if anyone is there when the old lady is standing right there in plain view?

I think it means my theory could be correct. Somehow. I believe this was an intentional clue to show us that the old lady wasn't really there in some capacity. And since we are dealing with crazies I figure it means she is also another imagined character. But in whose head?

James Macavoy's head? What would be the point in that? Surprise! It turns out he imagined the therapist! *Gasp* A schizo having an imaginary shrink. I don't think so. 

Could all of this be taking place in Mr. Glass' head? It's possible, I suppose. But to me, that seems too obvious and kinda anti-climactic. Lazy even.

To me.. it's gotta be the girl. Right? Think about it for a sec. It seems like each super character could represent a different type of coping mechanism of having a big, fat, hairy uncle molest you.

Let's start with Unbreakable himself and also his son. The girl lost her dad who she clearly looked up to. The one who could've protected her, but didn't and unknowingly allowed her to be molested cuz she didn't speak up. And then of course died. SO she imagines a version where her dad can't die and she's his little sidekick who helps him discover his powers. Perhaps as she should've done by telling him she was being raped. And not only that, he's a fucking badass hero that could easily choke out a big dude. Kinda like the uncle. 

It just occurred to me that it's interesting that Unbreakable choked out the orange man. Wasn't the uncle wearing orange hunting colors? I can't remember. I don't exactly wanna go Google CHILD MOLESTATION SCENE. So forgive me.

Okay so now we have Mr Glass. That could easily represent the broken feeling of being raped by a big fat hairy uncle,right? He's broken yet he's highly intelligent. Much like she is. Mainly due to the fact that she has been put through adversity like Mr. Glass.

It's like Unbreakable and Mr. Glass represent a kind of duality for her character. On one hand she needs to be strong to face life having to be raped by a fat uncle, as she clearly is... yet at the same time she is broken by it.

Then we have Split. This one is multi-faceted. To me.. he seems like some kinda agent of agency. If that makes sense. Let me back up a sec though. If she is in fact crazy now, she might have some vague understanding of that fact. If she's in the system or seeing a shrink, she is no doubt surrounded by folks telling her she is crazy and trying to treat her for it, et cetera. So he could represent a a version where she realizes in some sense she is delusional. 

He (and the movie's plot) would also represent a scary situation that she herself survives, ya know? She didn't have to create a hero or powers to survive him. She doesnt have to be a villain and forward her hurt on others like Mr. glass. 

Instead of being a victim, she used her real life ingenuity and agency to survive him and in the end this part of her psyche acknowledged her for it. It howls as it realizes she is strong and beautiful for having survived some shit in life. Ya know? And she just so happens to immediately take agency against her uncle in the end of the movie. Hmmm.

She could pretend it's not happening and let it continue by numbing herself to it: Unbreakable.

She could let it break her and in turn let it turn her into a villain to society, cutting herself, being miserable and distant to other girls etc: Mr. Glass

Or she could take a giant step back and literally GET some agency in life and do something about it: Split.

But also..I believe Split represents a sort of balance between the two extremes, or a catalyst to it. And the coming film, Glass is the result of her waking up to this and taking agency. But it's not so simple and there will be a battle in her psyche between them all. 

The three form like a triangle with Split being at the top point.. and her character is a spot above the triangle if that makes sense. I believe the next movie will really establish this as this most recent one had to kind of set it up.

If you think this isn't possible cuz of her age I would posit that each delusion comes with a fully fleshed out back story, just like Split does, and she wouldn't exactly need to fit a tight timeline. She is 3 or 4 and starts imagining a hero figure. Then she imagines the movie Unbreakable over time etc.



Anyway so all that aside. I also noticed the movie is like a meta story about Shyamalan himself. This is what ultimately led to my whole theory in the first place. 

Basically M Night retconned his own tumultuous relationship with Hollywood and success into the Unbreakable universe.

He was this new badass writer AND director. He was celebrated as the best shit since sliced bread. Sixth Sense. 

He makes Unbreakable, his masterpiece, the best hero film ever made. Nobody really goes to see it. He knows it's the shit, but money talks. Doubt creeps in. He better go with the plot twist hard next time.

He makes Signs. It's a success. Phew. But did people like, get it? Or did they just like aliens and Mel Gibson? Oh well, his real fans got it. Fuck the plebs. He's the shit.

He makes The Village, a beautiful love story disguised as a horror story. Nobody got this one. They shit all over it. Cuz they're dumb. He is the shit. Fuck em.

He makes Lady In The Water and shits back at the plebs writing himself in as a world changing brilliant writer and also writes in plebs to be  eaten by monster. Well, the plebs shit back harder, big time.

Everyone turns on him and he makes dud after dud after dud for years. Fuck. Was everyone right? Is he NOT the shit?

So then he starts writing Split. I believe he represents the girl in the story for sure as well as Macavoy's character. 

Basically, M. Night sees himself as both a good and bad director. He wants to believes he's a good director. Unbreakable. He doubts himself. Mr. Glass. And the movie Split is his battle between the two ways he sees himself. As he is writing, he realizes he's got a hit on his hands. He has hope again! Just like the girl does by the end of the film. He sees his failures as learning experiences etc.

Anyway that's my long ass double theory. Sorry for the long read.
",False,0.0,0.0,1.0,0.0
"Camera Angles Movement: Rules of the Game, by Jean Renoir",movies,4,a3g4yz,https://www.youtube.com/watch?v=o-s3LXKoa4c,0,2018-12-05 15:19:51,,False,0.0,0.0,1.0,0.0
Is there a good way to find a movie reviewer with similar taste to me?,movies,1,a3jffq,https://www.reddit.com/r/movies/comments/a3jffq/is_there_a_good_way_to_find_a_movie_reviewer_with/,21,2018-12-05 21:14:47,"With YouTube, rotten tomatoes, and hundreds of podcasts it feels like there are millions of movie reviewers and I'm having a hard time finding someone with opinions consistently similar to my own.  I've been going to rotten tomatoes and looking at movies that I had a strong opinion on, good or bad, and finding reviewers that felt the same about the movie and I'm just not having any luck.  I'll find someone where the half paragraph blurbs match up, but then when I go to the full review they have charged political opinions they unnecessarily include or they enjoyed the movie for a completely different reasons than my own.  Is there a better way of doing this?

Edit - movie critic is the term I should have used",False,0.4404,0.0,0.805,0.195
Icebox: the harrowing drama about child separation in America,movies,0,a3nc3f,https://www.theguardian.com/film/2018/dec/06/icebox-hbo-daniel-sawka-interview-immigration,2,2018-12-06 06:56:45,,False,0.0,0.0,1.0,0.0
I have an interesting idea that I would like to try out and I need your help.,movies,40,a395zq,https://www.reddit.com/r/movies/comments/a395zq/i_have_an_interesting_idea_that_i_would_like_to/,35,2018-12-05 00:17:26,"I am going to list my 10 favorite movies and I want you to reply to this with your 10 favorite movies other than the ones I listed.  I then want someone to reply to that person listing their 10 favorite movies that neither of us have listed and so on and so on.  I hope in this way to get a collective top 100 or so from a variety of different minds and tastes.

Edit: After x people reply and I get a list of 100 I’ll likely post that and I plan on watching them all.  I’ve actually reconsidered and depending on the amount of people that contribute I may make the list longer, maybe a few hundred.

Edit again: Also make sure to let us know what movies you would have picked but have already been chosen!

My top 10

1. Casablanca 

2. Taxi Driver 

3. Chinatown 

4. Lawrence of Arabia 

5. Vertigo 

6. The Godfather 

7. The Godfather: Part II

8. The Good, The Bad and the Ugly 

9. Alien 

10. The Graduate ",False,0.7845,0.0,0.582,0.418
Directors you don't like that made one movie you love.,movies,0,a3kpq4,https://www.reddit.com/r/movies/comments/a3kpq4/directors_you_dont_like_that_made_one_movie_you/,48,2018-12-05 23:54:51,"Earlier today I watched T2 Trainspotting, which I felt was an embarrassing nostalgia trip over the original. Having completed Danny Boyle's filmography, I realized that apart from Trainspotting, which I really liked, all of his other movies range from passable (Slumdog Millionaire, 127 Hours) to awful (A Life Less Ordinary, The Beach) for me. The closest he's come to a good movie is Sunshine, which is good for 60 minutes and terrible for the last 30 or so. He picks seriously flawed screenplays, his style is obnoxious, but for just one film 20 years ago it worked beautifully well with the source material.  
What are some directors who you feel ""lucked out"" the one time but never again came even close?
",False,0.4749,0.147,0.559,0.294
"""Ben Is Back"" in Theaters anywhere??",movies,0,a3knt2,https://www.reddit.com/r/movies/comments/a3knt2/ben_is_back_in_theaters_anywhere/,4,2018-12-05 23:47:25,"Hi everybody, so I saw that this movie ""Ben is back"" is coming out on Friday but I can not seem to find any theaters not just near me showing it at all, but anywhere in the country. I am curious if anyone here might have an explanation on this since I really would like to see this movie as its subject matter hits kind of close to home, but not being able to find any theater showings in the whole country is a bit go a problem lol.

Thanks for anybody who might have any ideas or explanations ",False,0.0,0.0,1.0,0.0
Marvel Studios' Captain Marvel - Trailer 2,movies,31711,a2w9hs,https://www.youtube.com/watch?v=0LHxvxdRnYc,4416,2018-12-03 21:44:23,,False,0.6808,0.0,0.349,0.651
"Gremlins director Joe Dante still has a few gremlin puppets hanging out in his garage... the rubber is rotting, he says, making them look even more like gremlins",movies,539,a31ax7,https://www.syfy.com/syfywire/gremlins-director-joe-dante-looks-back-on-the-movies-and-comics-that-shaped-him,56,2018-12-04 09:48:48,,False,0.4201,0.0,0.903,0.097
The Clergy (Kler) Polish film is literally impossible to find anywhere to watch. What gives?,movies,1,a3ge1g,https://www.reddit.com/r/movies/comments/a3ge1g/the_clergy_kler_polish_film_is_literally/,10,2018-12-05 15:45:42,"I've been looking for this film and no one is offering it. Theaters, streaming, online, nothing. How am I supposed to watch this film that is making waves in Europe if it isn't available to anyone in the States? 

This is absurd. Does anyone have any idea how I can watch this movie? I'm sick and tired of theaters (and the public in general) in the U.S just caring about Marvel junk. Cinema is honestly dead in the States. Do adults even go to the theaters anymore? Last time I saw someone over 25 at a movie theater on a normal night was maybe 2-3 years ago. None of my circle of friends watch or care about movies anymore. If anything they watch TV/series. 

This is getting bad. /rant 

But I'd appreciate anyones help. ",False,0.0,0.0,1.0,0.0
Pyrrhic victories in horror movies,movies,0,a3ketw,https://www.reddit.com/r/movies/comments/a3ketw/pyrrhic_victories_in_horror_movies/,17,2018-12-05 23:14:56,"I'm a huge fan of horror movies (mainly psychological horror) and while talking to a family member about horror movies, we got on the topic of pyrrhic victories in horror. I could be wrong, but I feel like pyrrhic victories in horror movies don't happen very often. More often than not, it's either the happy ending where the protagonist wins and everything is peachy after that or the bittersweet ending where the protagonist wins, but not without having lost something or someone they care about. But, to my knowledge, I haven't really seen a horror movie with a true pyrrhic victory where the protagonist may as well have lost because they've lost so much in their trek to victory.

&#x200B;

For horror movie fans, would you agree or disagree? What are some horror movies with pyrrhic victories you enjoy? Any recommendations?",False,-0.5719,0.481,0.519,0.0
Help me find the name of this space and/or alien contact movie from the '90s? movie,movies,0,a3ketn,https://www.reddit.com/r/movies/comments/a3ketn/help_me_find_the_name_of_this_space_andor_alien/,6,2018-12-05 23:14:54,"I can only remember one scene from this movie but I've been dying to figure out what it is. I can't even remember the actor's name because his career ended in the '90s early '00s. Anyway, he was an average height, white guy with black hair and kind of round/big eyes. Handsome man, I can't remember his name. Near the end of the movie, he sees all creations of life shoot past him. It's almost like they're holograms that have been made by the mysterious thing/alien they are trying to contact. I specifically remember dinosaurs and he's definitely in an astronaut suit. I think this is the climactic point of the movie and it is the only way they can make contact with the aliens/mysterious light thing. I know nothing else! If you can help I would appreciate it.",False,0.4019,0.0,0.847,0.153
How Real Are War Movies?,movies,1,a3ifl1,https://www.youtube.com/watch?v=Q8Vpz4ehlgQ,0,2018-12-05 19:18:52,,False,-0.5994,0.494,0.506,0.0
I wasn't expecting Mission Impossible: Fallout to have a killer soundtrack.,movies,291,a32qdk,https://www.reddit.com/r/movies/comments/a32qdk/i_wasnt_expecting_mission_impossible_fallout_to/,140,2018-12-04 12:23:26,"It's the sixth film in a series, and yet as a series, it consistently stays good (though your definition of ""good"" may vary from ""holy shit"" to ""just good""). And for all the greatness that came with Fallout, I wasn't for a second expecting its soundtrack to be as fucking good as it is.

Lorne Balfe perfectly captures espionage with a simple piano note that almost sounds paranoid and when it needs to kick your ass, it seduces you with an orchestra working overtime. I couldn't stop thinking about it when I was watching the film, nor praising it. It was ""there"", but in a way it's ""there"" to stay with you forever and not just being off-putting like some scores do.

I doubt it'll come true, but I really hope this film gets an Oscar nod for ""Best Soundtrack"". It's absurd how good this soundtrack is.

Anyway, just wanted to share my thoughts on it. What do you think of it?",False,-0.6486,0.35,0.65,0.0
What are some of the best Steadicam scenes in film?,movies,5,a3cn9m,https://www.reddit.com/r/movies/comments/a3cn9m/what_are_some_of_the_best_steadicam_scenes_in_film/,16,2018-12-05 09:15:23,"One of my favorite Steadicam sequences is during the climax of Carlito’s Way at the train station where Al Pacino is evading the mob guys who are trying to kill him, it’s not a particularly long take but it’s pretty effective and basically looks awesome for its time. 

Another one of my favorite scenes is the tracking shot in Goodfellas where the camera follows Henry and his girlfriend as they walk through the club.

What are some of your favorite scenes that employ the use of Steadicam?",False,0.6369,0.0,0.682,0.318
"""Mary Poppins Returns"" Early Reactions Praise Blunt's 'Magical' Performance",movies,0,a3n2fy,https://www.cbr.com/mary-poppins-returns-early-reactions-praise-blunts-performance/,1,2018-12-06 06:13:20,,False,0.5574,0.0,0.69,0.31
Timotheé Chalamet & Emma Stone - Actors on Actors - Full Conversation,movies,226,a32z5u,https://www.youtube.com/watch?v=rFPA_RW02ZM,147,2018-12-04 12:48:06,,False,0.0,0.0,1.0,0.0
saw Aquaman and realize what DC movie needs (no spoilers),movies,864,a2zf5u,https://www.reddit.com/r/movies/comments/a2zf5u/saw_aquaman_and_realize_what_dc_movie_needs_no/,544,2018-12-04 05:12:12,"So I saw Aquaman today, and I can say the reactions weren't exaggerating, It's really fun, the action is spectacular, full of long takes and creative angles, the characters are all really colorful. But what impress me the most is how much this movie is willing to embrace cheesiness. For me, The Conjuring movies are so memorable because of the right amount of cheese, and James Wan does it again with this one. Pop music blasting with slow mo when Arthur and Mera comes out of water; Arc shot with Mera's smirk when she suddenly realizes something important; Being unabashedly melodramatic etc. Basically just not taking itself too seroiusly. Sorry if this post is being kinda vague, just wanna express my appreciation of what Wan brings to this movie.",False,0.0,0.0,1.0,0.0
Dolly Parton singing I Will Always Love You from The Best Little Whorehouse in Texas - full scene,movies,36,a37yfy,https://www.youtube.com/watch?v=HnA0uv7wko4,7,2018-12-04 21:46:22,,False,0.8221,0.078,0.56,0.362
Honest Trailers - Mission: Impossible - Fallout,movies,187,a336p5,https://www.youtube.com/watch?v=vwqWao8xvig,91,2018-12-04 13:09:24,,False,0.5106,0.0,0.548,0.452
Can we please get a David Bowie biopic directed by his son Duncan Jones?,movies,0,a3hfw7,https://www.reddit.com/r/movies/comments/a3hfw7/can_we_please_get_a_david_bowie_biopic_directed/,12,2018-12-05 17:33:17,"The only person on Earth that ever matched Freddie Mercury's big dick energy was Ziggy. The Thin White Duke. 

David Bowie's career was built on characters of his own creation. And I think if there's anyone out there who could and would do the man justice, it would be his own son.

I'm yet to see Moon -- I hear it's good, but between you and me... I kinda liked Warcraft. Wasn't the best movie, but it was sure as shit true to its source.

I would love to see what Duncan could do with the story of his father.",False,0.3182,0.0,0.839,0.161
From which movie is this scene?,movies,0,a3m1s0,https://i.redd.it/q6ee56z69m221.png,15,2018-12-06 03:14:34,,False,0.0,0.0,1.0,0.0
Heavy Metal | New York City 2031,movies,91,a359ih,https://www.youtube.com/watch?v=vOiE6ENJ1AA,22,2018-12-04 16:45:23,,False,0.0,0.0,1.0,0.0
Every film mentioned by Edgar Wright and Quentin Tarantino in their Hot Fuzz commentary,movies,56,a36uxg,https://letterboxd.com/heymason/list/every-film-mentioned-by-edgar-wright-and/,1,2018-12-04 19:37:28,,False,0.0,0.0,1.0,0.0
Russo Brothers will be at TGA Tomorrow,movies,0,a3gyu0,https://www.reddit.com/r/movies/comments/a3gyu0/russo_brothers_will_be_at_tga_tomorrow/,9,2018-12-05 16:45:04,"With Avengers 4 trailer rumors flying around, I wanted to bring up something that is confirmed happening: The Russo Brothers, the directors of Infinity War, [will be at The Game Awards tomorrow night.](https://twitter.com/geoffkeighley/status/1070371088507396096)

Why is this relevant? If you guys remember back in May, Fortnite (a hugely popular video game among general audiences) got a massive Marvel crossover with a limited time Thanos event. This is significant because [the Russo Brothers are Fortnite fans and are the ones that helped make the crossover possible](https://nerdist.com/avengers-infinity-war-fortnite-crossover-nerdist-news/) to begin with.

With all that in mind, I thought it's worthwhile mentioning the Game Awards for those interested in keeping up with Avengers news. This event always gives new info about upcoming games, and it wouldn't be out of place to start extending that to other mediums as the event grows. The event in itself is a massive crossover of multiple media mediums this year. If you're looking for potential to be the first to see news regarding the next Avengers film, maybe check it out tomorrow night...",False,0.0,0.0,1.0,0.0
Why Oscar Host Is the Worst Job in Town,movies,136,a33kcz,https://www.hollywoodreporter.com/news/why-oscar-host-is-worst-job-town-1165880,132,2018-12-04 13:51:18,,False,-0.6249,0.339,0.661,0.0
"Those of you who are fans of high level creativity in movies, what other creative fields are you interested in?",movies,0,a3l6zl,https://www.reddit.com/r/movies/comments/a3l6zl/those_of_you_who_are_fans_of_high_level/,24,2018-12-06 01:01:04,"Yes, I know this may seem like a dumb or useless question but please do not post if you do not really want to answer the question.

&#x200B;

If you think I am elitist or whatever, then do not post in the thread. No need to comment that I am.

&#x200B;

Fans of high level creativity in films and TV shows may love projects like There Will be Blood, Holy Mountain, The Grand Budapest Hotel, The Sopranos, etc... 

&#x200B;

Photography? Music? Art? Fashion? What other creative fields quench your artistic and creative thirst",False,0.802,0.0,0.675,0.325
Terminator 3 may be the key to ending the Terminator franchise.,movies,19,a38sl8,https://www.reddit.com/r/movies/comments/a38sl8/terminator_3_may_be_the_key_to_ending_the/,37,2018-12-04 23:29:48,"This just hit me as I was watching Terminator Salvation; if the future is inevitable but can be delayed, why not have it work for both sides plot wise? Let's have a movie where John Connor or Sarah Connor dies, but someone else rises up to become the great leader of the resistance. The machines then realize they can only delay their inevitable downfall and cannot compete with the human spirit. No matter who they kill we will always survive and fight back. Happy ending the end.",False,0.0,0.0,1.0,0.0
Was John Travolta's dancing in Saturday Night Fever considered very good back in the day?,movies,0,a3gdb2,https://www.reddit.com/r/movies/comments/a3gdb2/was_john_travoltas_dancing_in_saturday_night/,31,2018-12-05 15:43:39,"I haven't seen the movie itself but I saw the famous scene on the disco floor a couple of times and it always struck me as really average. It seems weird that everyone around him is watching him dance as it doesn't seem all that special.

Am I just not that good at spotting good dancers or am I spoiled with how well people dance nowadays, or wasn't it all that special back then either? ",False,0.4927,0.0,0.814,0.186
