title,subreddit,score,id,url,num_comments,created_utc,selftext,over_18,compound,neg,neu,pos
"Eighth Grade, Adam McKay, Ethan Hawke and Toni Collette among the winners of the 2018 Detroit Film Critics Society Awards",movies,16,a2r86p,http://detroitfilmcritics.com/awards/,6,2018-12-03 13:10:07,,False,0.5994,0.087,0.672,0.241
"Guillermo del Toro Talks ""Political"" 'Pinocchio,' Confirms 'Terrifed' Remake",movies,67,a2nmag,https://www.hollywoodreporter.com/news/gillermo-del-toro-talks-pinocchio-confirms-terrifed-remake-1165632/,16,2018-12-03 05:53:46,,False,0.0,0.0,1.0,0.0
"Everyone here seems to be predicting an utter disaster box office wise when Mortal Engines comes out, but is there anyone here who is looking forward to seeing it?",movies,4,a2vmjs,https://www.reddit.com/r/movies/comments/a2vmjs/everyone_here_seems_to_be_predicting_an_utter/,18,2018-12-03 20:30:53,"I'm not usually a fan of DAE posts because of course there's always going to be somebody on the same page as you, but I find the gloomy outlook on the movie itself to be at least a little surprising. I haven't read the book, but I'm looking forward to watching this movie. It feels like a b-level popcorn flick with a very interesting concept and some fun visuals. Plus, Hugo Weaving is awesome. It's a movie I'm excited to watch in theater with my S.O. 

I've seen plenty of advertising before other movies, on TV, and on public transit. I get that December is going to be a total war-zone (that Mad Max post in /r/boxoffice was amazing) and I can totally see it losing out, but isn't there anybody kind of excited for this movie?",False,-0.128,0.081,0.854,0.065
"I'm constantly disappointed by movies. Can you save my time, by giving me recommendations, if I tell you what I (don't like)?",movies,0,a34dpl,https://www.reddit.com/r/movies/comments/a34dpl/im_constantly_disappointed_by_movies_can_you_save/,22,2018-12-04 15:14:33,"I'm pretty helpless. I find almost all movies to be superficial, obvious and unrealistic.  I do like ""intelligent"" movies but the results one gets when searching for this are pretty laughable. I found ""Waking Life"" horribly childish and pretentious at the same time. ""Sherlock"" was also disappointing and I don't think that a movie is ""intelligent"" because it manages to portray a character that is apparently intelligent (which is narrated by his borderline supernatural ability to make correct but unnecessary conclusions from cues that are partly hidden from the audience).  

Regardless of the legitimacy of this judgement, I'm wondering if there are any movies that I could like. 

Here are some movies that I found really good:  The Life of Brian,  Adams Apples, Flickering Lights,  Idiots, Volver, Italian for Beginners, Dog Days, Le Havre....

Some more.  Directors I liked were Thomas Anders Jensen, Lars von Trier, Aki Kaurismäki, Ulrich Seidl and the Monthy Pythons. 

I did like these movies not because they were straightforward realistic but because they caught something that I would regard as ""typically human"", and in some movies (like in ""Italian for Beginners"") as authentic.  Furthermore I liked the cinematography in Aki Kaurismäkis movies and in the Movies by Ulrich Seidl (e.g. Paradies Liebe). 

If there is anything you find worth recommending for me, please tell me! I spend so many time searching for movies and I'm frequently disappointed. 

&#x200B;

&#x200B;",False,0.3612,0.121,0.661,0.218
Does anyone think Batman Returns (1992) is a horror film? Maybe a bit?,movies,20,a2qc65,https://www.reddit.com/r/movies/comments/a2qc65/does_anyone_think_batman_returns_1992_is_a_horror/,24,2018-12-03 11:41:20,"I never seen someone asked this question like I do now, but would you consider it a horror film? Maybe a bit? It scared me as a kid and still looks scary. Perhaps because Penguin is freaking scary. And it's also scary that a normal and shy woman becomes a criminal.

What do you think? Still my favorite Batman film though.",False,-0.6199,0.289,0.711,0.0
Johnny Depp Thought He Was Being Replaced By Tom Hanks on 'Edward Scissorhands',movies,21,a2qg9i,https://www.hollywoodreporter.com/heat-vision/johnny-depp-feared-tom-hanks-had-replaced-him-edward-scissorhands-1164467,3,2018-12-03 11:53:27,,False,0.0,0.0,1.0,0.0
Movie Inspired by Prince’s Music in the Works at Universal,movies,9,a2ta1b,https://variety.com/2018/film/news/universal-original-movie-inspired-by-princes-music-1203067739/,9,2018-12-03 16:31:17,,False,0.4939,0.0,0.738,0.262
What are some good Christmas movies that don’t get a lot of attention?,movies,3,a2vk1x,https://www.reddit.com/r/movies/comments/a2vk1x/what_are_some_good_christmas_movies_that_dont_get/,44,2018-12-03 20:23:01,"I was digging through my Christmas movies and unearthed an old American girl movie from when I was younger and decided to pop it in and see how it was. To my surprise it still held up as a pretty decent Christmas film and it got me thinking about other Christmas movies that don’t get mentioned much. Another one I can think of would be Tokyo Godfathers, which is a lot more. Adult than the former, but no less heartwarming. So what are your unappreciated holiday films?",False,0.4404,0.0,0.791,0.209
"Oscars: 'Aquaman', 'Avengers' and more advance in VFX Race",movies,3,a2ui5o,https://variety.com/2018/film/awards/oscars-aquaman-avengers-and-more-advance-in-vfx-race-1203078834/amp/?__twitter_impression=true,17,2018-12-03 18:25:23,,False,0.0,0.0,1.0,0.0
"Lars von Trier on filmmaking and fear: ‘Sometimes, alcohol is the only thing that will help’",movies,6,a2s3nh,https://www.theguardian.com/film/2018/dec/03/lars-von-trier-on-filmmaking-and-fear-sometimes-alcohol-is-the-only-thing-that-will-help,3,2018-12-03 14:37:01,,False,-0.4939,0.176,0.824,0.0
I just recently watched The Truman Show again.,movies,135,a2l3e9,https://www.reddit.com/r/movies/comments/a2l3e9/i_just_recently_watched_the_truman_show_again/,64,2018-12-02 23:22:51,"... and holy moly is it amazing. I feel like it took on another layer for me, since it had been about 5 years since I last saw it. In my early 20s I thought it was great, and held a lot of symbolism, but coming in to my late 20s there were different themes that stuck with me, like time lost, and stolen dreams. Do you guys have any movies that you like to revisit incrementally for similar reasons? I think rewatching Truman every 5 years, and maybe writing some kind of essay on it could be an interesting experience for me, and I wonder if anyone else feels similar about it, or another movie. ",False,0.0,0.0,1.0,0.0
0/10 movies of 2018?,movies,1,a2w9mx,https://www.reddit.com/r/movies/comments/a2w9mx/010_movies_of_2018/,64,2018-12-03 21:44:48,"While 2018 has been a marvelous and very impressive year in film, we also got some of the worst films ever put to screen. What was a movie you saw this year that you rated as a 0/10? Mine is a tie between Truth or Dare and Robin Hood. 

Truth or Dare was *awful.* The acting was awful, the plot made zero sense, and the deaths weren't even relatively scary or menacing. I was really close to walking out.

Robin Hood, on the other hand, was a million times worse. It had such a great cast, but they were wasted on the incompetent direction, crappy script and humour, and overall just boring and slow plot. This movie I actually walked out of. That's how bad it was. No one seemed to be trying, and I this movie felt more like a cash grab than an actual attempt to make a coherent Robin Hood film. I remember after walking out of it I went home and watched Men In Tights, which was a way better use of my time and brain cells. ",False,0.0,0.0,1.0,0.0
00:20 - I never realized Buzz is completely unaware of the existence of that huge button on his back. We don't lie to others as hard as we lie to ourselves.,movies,5,a2u5m9,https://www.youtube.com/watch?v=y3svog9aqUk,1,2018-12-03 17:51:28,,False,-0.0498,0.11,0.818,0.072
I made a website to explore Stanley Kubrick movies one random image at a time.,movies,790,a2fnkh,https://www.everysingleframe.com/,88,2018-12-02 13:21:12,,False,0.0,0.0,1.0,0.0
Wes Andersons next movie no longer a french musical,movies,217,a2j91n,https://news.avclub.com/wes-andersons-next-movie-is-no-longer-a-french-musical-1830809507,81,2018-12-02 19:40:18,,False,-0.296,0.239,0.761,0.0
Cahiers du Cinéma’s Best Films of 2018,movies,7,a2sbc6,https://www.indiewire.com/2018/12/cahiers-du-cinema-best-films-2018-house-that-jack-built-1202024875/,2,2018-12-03 14:58:21,,False,0.6369,0.0,0.588,0.412
"After Previous Attempts to Portray the HIV/AIDS Crisis Failed, Tom Hanks' 'Philadelphia' Was a Huge Risk That Paid Off",movies,1131,a2e1lo,https://www.hollywoodreporter.com/news/philadelphia-tackled-aids-taboo-25-years-1163833,179,2018-12-02 10:24:21,,False,-0.802,0.368,0.543,0.089
Robert De Niro Says 'The Irishman' Set for the Big Screen,movies,707,a2f1xs,https://www.hollywoodreporter.com/news/marrakech-robert-de-niro-says-irishman-set-big-screen-1165651,100,2018-12-02 12:19:17,,False,0.0,0.0,1.0,0.0
"Scorsese's ""Irishman"" Will Go Theatrical",movies,37,a2n2y1,http://www.darkhorizons.com/scorseses-irishman-will-go-theatrical/,4,2018-12-03 04:20:39,,False,0.0,0.0,1.0,0.0
"Minkow! is about the most unreal screenwriting experience of my life. It involved the mob, religion, Ponzi schemes, insider trading, $550M in restitution and the true story of a man who tried to tell a tale of redemption but brought on his biggest downfall. I made a podcast about it, hope you enjoy.",movies,0,a2x795,https://soundcloud.com/bobbyshaker/minkow,4,2018-12-03 23:35:09,,False,0.8845,0.0,0.816,0.184
"‘Hide And Seek’: Jonathan Rhys Meyers, Jacinda Barrett, Joe Pantoliano, Mustafa Shakir To Star In CJ Horror Remake",movies,9,a2qo9a,https://deadline.com/2018/12/hide-and-seek-jonathan-rhys-myers-jacinda-barrett-joe-pantoliano-mustafa-shakir-korean-horror-film-1202512687/amp/?utm_source=dlvr.it&utm_medium=twitter&__twitter_impression=true,0,2018-12-03 12:15:45,,False,-0.5719,0.179,0.821,0.0
Recommendations for coming of age/road trip type movies from post-2000?,movies,1,a2x5re,https://www.reddit.com/r/movies/comments/a2x5re/recommendations_for_coming_of_ageroad_trip_type/,16,2018-12-03 23:30:13,"In a bit of a mood, and thought I'd solicit some recommendations.  Thanks in advance.  I seem to be feeling a fairly specific type of movie: a low key drama (romantic elements not a dealbreaker) where

1. The movie opens with the protagonist at a crossroads in his/her life --- either the prototypical young adult slacker trying to get his life together, or the protagonist's life is threatening to come apart, or is disillusioned, for some reason,

2. the protagonist goes on a journey --- probably a true road trip, or possibly travels to his/her old hometown, and

3. of course, the protagonist learns life lessons or experiences revelations while meeting new people (and potentially a love interest).

Not to be snobby, but for generational relevancy the ideal movies should probably be produced after 2000 (and the protagonist should probably be between 20-30).  EXAMPLES: Stuff like *Garden State*, *The Lifeguard*, *The Puffy Chair*, etc. In contrast, *Road Trip* is a comedy, so wouldn't count; *Easy Rider* is too generationally removed; but as weird as it is, something like *Safety Not Guaranteed* probably would count, if this narrows it down.  (No points for guessing I can't afford to go on such a trip myself...)",False,0.0,0.0,1.0,0.0
Tyson Fury vs Deontay Wilder is more inspirational than Creed 2,movies,0,a31coe,https://www.reddit.com/r/movies/comments/a31coe/tyson_fury_vs_deontay_wilder_is_more/,4,2018-12-04 09:54:43,"For those who are aware of who these fighters are and the context of this fight, does anyone not find it amazing? Creed is supposed to be a motivational film series like Rocky, yet ironically the heavyweight fight that took place over this weekend was in my opinion, *more* inspirational than the Creed counterpart.

For those who don't know who these guys are:

- [Tyson Fury](https://en.wikipedia.org/wiki/Tyson_Fury) is a heavyweight boxer who dethroned heavyweight champion Wladimir Klitschko 3 years ago in Germany. [Here is the page for their fight](https://en.wikipedia.org/wiki/Wladimir_Klitschko_vs._Tyson_Fury), which sold out 55,000 seats stadium. Fury was a huge underdog but managed to win the fight and shock the world

- Since those 3 years, Fury went off the rails. Went into suicidal depression, ballooned up to 400lbs and abused drugs and alcohol. Came very close to killing himself

- [Deontay Wilder](https://en.wikipedia.org/wiki/Deontay_Wilder) becomes WBC heavyweight champion - has all KO wins but is criticized for fighting tomato cans. However he slowly begins to prove himself as a legitimate puncher

- Fury comes out of retirement and [decides to fight Deontay Wilder](https://en.wikipedia.org/wiki/Deontay_Wilder_vs._Tyson_Fury). He manages to cut down from 400lbs to 260lbs yet enters the fight a 25-1 underdog

- Yet Fury dances around Wilder, schools him and is winning on the scorecards to the surprise of everyone. He gets knocked down in the 9th round but gets up quickly, proceeds to carry on as normal but then in the 12th round he is hit and suffers a a VERY serious knockdown, his head hits the canvas clean...and pretty much everyone at this point believes Wilder has won (even Wilder himself celebrates), yet Fury gets up at the 9th second...somehow...pretty much the same way Adonis Creed does in the first Creed film.

- [Fury gives his £8 million purse to charity](https://www.mirror.co.uk/sport/boxing/tyson-fury-donate-entire-8m-13676994)

The fight results in a draw (which many believe is shocking and corrupt)...what I couldn't help but notice is that this fight seems MORE like a movie than real life, one day this could make a great fucking film.

[**Here is a clip of the knockdown that Fury got up from**](https://www.reddit.com/r/sports/comments/a2bjm1/deontay_wilder_knocks_tyson_fury_down_in_round_12/)

More news reports of the fight 

https://www.google.co.uk/search?q=deontay+wilder+vs+tyson+fury&source=lnms&tbm=nws&sa=X&ved=0ahUKEwiTn7rytobfAhVxs3EKHXAECGUQ_AUIDigB&biw=1366&bih=657

**I went to watch Creed 2 to get inspired as I usually do with most Rocky films, however the Fury-Wilder fight ended up inspiring me more than the actual inspirational film...**",False,-0.0276,0.242,0.523,0.235
Filming Fitzcarraldo,movies,9,a2q1gt,https://www.youtube.com/watch?v=mmbUobUc7Vs,2,2018-12-03 11:10:28,,False,0.0,0.0,1.0,0.0
What are some characters in movies that despite their personality. You end up kind of agreeing with the way they view things?,movies,9,a2ptu5,https://www.reddit.com/r/movies/comments/a2ptu5/what_are_some_characters_in_movies_that_despite/,60,2018-12-03 10:48:38,"I had a moment with that with The Ballad Of Buster Scruggs. In which a pompous Frenchman talk about what love is, and while that frenchman was an asshole, he did bring an interesting perspective on love and he has some great points.

Love doesnt have an universal meaning aside from the idealistic, personally love has several different meanings to different people. A celebrity wont have the same concept of love as the cashier at a supermarket. Different people will feel differently about certain concepts.",False,0.2748,0.0,0.909,0.091
I watched They Came Together (2014),movies,7,a2r0zc,https://www.reddit.com/r/movies/comments/a2r0zc/i_watched_they_came_together_2014/,10,2018-12-03 12:50:12,"They Came Together is a Rom-Com parody from David Wain Starring Paul Rudd and Amy Pohler. Wain who had been behind Wet Hot American Summer, Chidrens Hospital, Party Down, Burning Love and Another Period. Unfortunately, They Came Together dose not quite reach the heights of his other projects. There are a few truly laugh out loud moments, and quite a few well know and surprising cameos from comedy actors in the film but, a lot of jokes don't quite land. Still if your are a fan of Rom Coms or would just like to see them sent up I would recommend it. It is a quick watch at 83 minutes and is streaming on the Roku Channel this month.",False,0.0,0.0,1.0,0.0
Name of Zombie Movie?,movies,0,a2wj9e,https://www.reddit.com/r/movies/comments/a2wj9e/name_of_zombie_movie/,5,2018-12-03 22:15:05,"I remember it was on Netflix, and was foreign I think because all the actors had an accent. And it was about a guy who was documenting himself in and out. He took refuge in an abandoned Apache airbase I think? And he slept in a tower. Later in the movie he finds a dad, his daughter and her boyfriend/fiancé, two brothers in which one is a germaphobe, and a prisoner who was surviving off of toilet paper and toilet water in a police station? At the end of the movie there’s a big zombie and the main protagonist shoots a fire arrow into a car where the gas is poured in and it blows up. And one of the brother dies at like a castle or something I think. ",False,0.0,0.0,1.0,0.0
‘The Monster Squad’ Director Fred Dekker Hasn’t Directed Since 1993 But He’s Looking for a New Project,movies,140,a2j4jb,https://bloody-disgusting.com/movie/3535539/monster-squad-director-fred-dekker-hasnt-directed-since-1993-hes-looking-new-project/,27,2018-12-02 19:25:37,,False,0.0,0.0,1.0,0.0
Why hasn't Apollo Creed's infidelity been addressed in the Creed films?,movies,0,a30d61,https://www.reddit.com/r/movies/comments/a30d61/why_hasnt_apollo_creeds_infidelity_been_addressed/,12,2018-12-04 07:46:10,"Obviously everyone knows he cheated, however this doesn't seem to change the character's views of him. Rocky still loves him, Adonis still looks up to him in spite of his cheating and Apollo's wife doesn't seem that bothered.

Basically, everyone still treats Apollo as he was...his infidelity just seems glossed over. I am curious as to what others here think of this detail.",False,0.0,0.0,1.0,0.0
Zombieland 2 Adds Avan Jogia,movies,36,a2mg2e,https://www.empireonline.com/movies/zombieland/zombieland-2-adds-avan-jogia/?fbclid=IwAR23pMcw5Tg5Ib4c4JzXRXG_C2BVcLw6XU0y17oToVwdv_SepGYWA9zJABQ/,17,2018-12-03 02:31:43,,False,0.0,0.0,1.0,0.0
What are some movies you think would be great as remakes/reboots?,movies,4,a2qzgg,https://www.reddit.com/r/movies/comments/a2qzgg/what_are_some_movies_you_think_would_be_great_as/,51,2018-12-03 12:46:06,"Maybe this gets asked often. Kinda new here. But I’d love to hear some suggestions for movies that SHOULD get a remake. So often I think Hollywood remakes movies that are already classics, but really they should be taking movies that had great ideas but either didn’t execute properly or bombed at the box office. What do you got?",False,0.6249,0.0,0.709,0.291
Roma Wins Best Picture at 2018 WAFCA Awards,movies,14,a2olhp,http://www.dcfilmcritics.com/awards/,15,2018-12-03 08:23:20,,False,0.8979,0.0,0.314,0.686
Need help finding movies where troublesome kids go on to become criminals,movies,0,a2w01h,https://www.reddit.com/r/movies/comments/a2w01h/need_help_finding_movies_where_troublesome_kids/,19,2018-12-03 21:14:22,"Hi everyone,

 I'm writing a paper for a class and its on juvenile justice issues. I'm looking for movies that have examples of kids who have shown signs of bad and dangerous behavior from an early age and then go one to commit crimes (any kind) in the future. They may have even committed crimes as kids and just kept continuing it until they became adults. Thanks for the help! Appreciate it ",False,-0.6486,0.374,0.481,0.144
The Predator 2018 is good,movies,0,a31970,https://www.reddit.com/r/movies/comments/a31970/the_predator_2018_is_good/,32,2018-12-04 09:43:07,"I wouldn't rate it any lower than any other Predator movies.
The Predator gets more screen time, we get some explanations about its gadgets, some good action, Predator gore & the story is good enough for a sci-fi movie. There's some stupid parts, but that's how I like it. I don't care about faultless movies.
I liked the chemistry of the main cast as well especially Olivia Munn who just looks gorgeous. The loonies are cute
Like always, popular movie critics are just misleading since they have different ways of viewing movies than common people.",False,0.4404,0.0,0.58,0.42
Movies about dealing with failure?,movies,20,a2n7zm,https://www.reddit.com/r/movies/comments/a2n7zm/movies_about_dealing_with_failure/,67,2018-12-03 04:45:18,I've given something my all and I guess my all wasn't really even close to enough.  I'm not in a great place but I have some time to watch some movies later in the week and was wondering what movies you guys like that perhaps deal with themes of failure and maybe powerlessness. Or just not being good enough.  They can be tonally light or dark.  I don't mind either way.,False,-0.5106,0.452,0.548,0.0
